aiter/configs/a8w8_tuned_gemm.csv
M,N,K,kernelId,splitK,us,kernelName
1,1280,8192,34,0,19.5424,a8w8_rowwise_256x16x64x512_16x16_1x1_32x8x1_32x8x1_1x16x1x16_4x4x1_1x1_intrawave_v3
32,1280,8192,34,0,17.904,a8w8_rowwise_256x16x64x512_16x16_1x1_32x8x1_32x8x1_1x16x1x16_4x4x1_1x1_intrawave_v3
64,1280,8192,34,0,18.0876,a8w8_rowwise_256x16x64x512_16x16_1x1_32x8x1_32x8x1_1x16x1x16_4x4x1_1x1_intrawave_v3
128,1280,8192,30,0,22.4841,a8w8_rowwise_256x32x64x512_16x16_1x2_32x8x1_32x8x1_1x32x1x8_8x8x1_1x2_intrawave_v3
192,1280,8192,23,0,31.8973,a8w8_rowwise_256x64x64x512_32x32_1x1_32x8x1_32x8x1_1x32x1x8_8x8x1_1x1_intrawave_v3
256,1280,8192,23,0,32.7273,a8w8_rowwise_256x64x64x512_32x32_1x1_32x8x1_32x8x1_1x32x1x8_8x8x1_1x1_intrawave_v3
320,1280,8192,15,0,52.853,a8w8_rowwise_256x128x64x256_32x32_2x1_16x16x1_16x16x1_1x32x1x8_8x8x1_1x1_intrawave_v3
512,1280,8192,15,0,49.7042,a8w8_rowwise_256x128x64x256_32x32_2x1_16x16x1_16x16x1_1x32x1x8_8x8x1_1x1_intrawave_v3
1024,1280,8192,35,0,74.913,a8w8_rowwise_256x128x128x128_32x32_2x2_8x32x1_8x32x1_1x32x1x8_8x8x1_1x1_intrawave_v4
2048,1280,8192,41,0,137.976,a8w8_rowwise_256x128x128x128_32x32_2x2_8x32x1_8x32x1_1x32x1x8_8x8x1_1x1_intrawave_v5
4096,1280,8192,0,0,242.9391,a8w8_rowwise_256x256x256x64_32x32_4x4_4x64x1_4x64x1_1x32x1x8_8x8x1_1x1_intrawave_v4
8192,1280,8192,0,0,484.1535,a8w8_rowwise_256x256x256x64_32x32_4x4_4x64x1_4x64x1_1x32x1x8_8x8x1_1x1_intrawave_v4
16384,1280,8192,0,0,964.9873,a8w8_rowwise_256x256x256x64_32x32_4x4_4x64x1_4x64x1_1x32x1x8_8x8x1_1x1_intrawave_v4
1,8192,1024,78,0,7.6804,a8w8_rowwise_64x16x16x128_16x16_1x1_8x8x1_8x8x1_1x16x1x4_4x4x1_1x1_interwave_v2
32,8192,1024,28,0,9.3612,a8w8_rowwise_256x32x128x256_32x32_1x1_16x16x1_16x16x1_1x32x1x8_8x8x1_1x1_intrawave_v3
64,8192,1024,47,0,10.9104,a8w8_rowwise_256x64x64x128_32x32_1x1_8x32x1_8x32x1_1x32x1x8_8x8x1_1x1_intrawave_v3
128,8192,1024,45,0,17.0225,a8w8_rowwise_256x128x64x128_32x32_2x1_8x32x1_8x32x1_1x32x1x8_8x8x1_1x1_intrawave_v3
192,8192,1024,47,0,22.0241,a8w8_rowwise_256x64x64x128_32x32_1x1_8x32x1_8x32x1_1x32x1x8_8x8x1_1x1_intrawave_v3
256,8192,1024,13,0,26.2673,a8w8_rowwise_256x128x128x128_32x32_2x2_8x32x1_8x32x1_1x32x1x8_8x8x1_1x1_intrawave_v3
320,8192,1024,46,0,32.6397,a8w8_rowwise_256x64x128x128_32x32_1x2_8x32x1_8x32x1_1x32x1x8_8x8x1_1x1_intrawave_v3
512,8192,1024,2,0,47.1309,a8w8_rowwise_256x256x224x128_32x32_2x7_8x32x1_8x32x1_1x64x1x4_8x8x1_2x1_intrawave_v3
1024,8192,1024,36,0,81.4171,a8w8_rowwise_256x128x128x64_32x32_2x2_4x64x1_4x64x1_1x32x1x8_8x8x1_1x1_intrawave_v4
2048,8192,1024,36,0,145.6152,a8w8_rowwise_256x128x128x64_32x32_2x2_4x64x1_4x64x1_1x32x1x8_8x8x1_1x1_intrawave_v4
4096,8192,1024,36,0,281.4516,a8w8_rowwise_256x128x128x64_32x32_2x2_4x64x1_4x64x1_1x32x1x8_8x8x1_1x1_intrawave_v4
8192,8192,1024,36,0,552.3865,a8w8_rowwise_256x128x128x64_32x32_2x2_4x64x1_4x64x1_1x32x1x8_8x8x1_1x1_intrawave_v4
16384,8192,1024,36,0,1092.0941,a8w8_rowwise_256x128x128x64_32x32_2x2_4x64x1_4x64x1_1x32x1x8_8x8x1_1x1_intrawave_v4
1,1280,4096,34,0,9.1693,a8w8_rowwise_256x16x64x512_16x16_1x1_32x8x1_32x8x1_1x16x1x16_4x4x1_1x1_intrawave_v3
32,1280,4096,34,0,9.9383,a8w8_rowwise_256x16x64x512_16x16_1x1_32x8x1_32x8x1_1x16x1x16_4x4x1_1x1_intrawave_v3
64,1280,4096,30,0,10.7357,a8w8_rowwise_256x32x64x512_16x16_1x2_32x8x1_32x8x1_1x32x1x8_8x8x1_1x2_intrawave_v3
128,1280,4096,47,0,15.291,a8w8_rowwise_256x64x64x128_32x32_1x1_8x32x1_8x32x1_1x32x1x8_8x8x1_1x1_intrawave_v3
192,1280,4096,47,0,15.4762,a8w8_rowwise_256x64x64x128_32x32_1x1_8x32x1_8x32x1_1x32x1x8_8x8x1_1x1_intrawave_v3
256,1280,4096,15,0,22.3224,a8w8_rowwise_256x128x64x256_32x32_2x1_16x16x1_16x16x1_1x32x1x8_8x8x1_1x1_intrawave_v3
320,1280,4096,47,0,23.8387,a8w8_rowwise_256x64x64x128_32x32_1x1_8x32x1_8x32x1_1x32x1x8_8x8x1_1x1_intrawave_v3
512,1280,4096,47,0,31.4125,a8w8_rowwise_256x64x64x128_32x32_1x1_8x32x1_8x32x1_1x32x1x8_8x8x1_1x1_intrawave_v3
1024,1280,4096,11,0,46.0759,a8w8_rowwise_256x128x160x128_32x32_1x5_8x32x1_8x32x1_1x64x1x4_8x8x1_1x1_intrawave_v3
2048,1280,4096,4,0,77.3851,a8w8_rowwise_256x256x160x128_32x32_2x5_8x32x1_8x32x1_1x64x1x4_8x8x1_2x1_intrawave_v3
4096,1280,4096,41,0,150.6678,a8w8_rowwise_256x128x128x128_32x32_2x2_8x32x1_8x32x1_1x32x1x8_8x8x1_1x1_intrawave_v5
8192,1280,4096,41,0,290.1264,a8w8_rowwise_256x128x128x128_32x32_2x2_8x32x1_8x32x1_1x32x1x8_8x8x1_1x1_intrawave_v5
16384,1280,4096,0,0,543.4556,a8w8_rowwise_256x256x256x64_32x32_4x4_4x64x1_4x64x1_1x32x1x8_8x8x1_1x1_intrawave_v4
1,4096,1024,49,0,5.1184,a8w8_rowwise_64x16x16x128_16x16_1x1_8x8x1_8x8x1_1x16x1x4_4x4x1_1x1_intrawave_v1
32,4096,1024,67,0,5.6184,a8w8_rowwise_128x32x16x128_16x16_1x1_8x16x1_8x16x1_1x16x1x8_2x2x1_1x1_interwave_v1
64,4096,1024,47,0,6.6623,a8w8_rowwise_256x64x64x128_32x32_1x1_8x32x1_8x32x1_1x32x1x8_8x8x1_1x1_intrawave_v3
128,4096,1024,47,0,9.4933,a8w8_rowwise_256x64x64x128_32x32_1x1_8x32x1_8x32x1_1x32x1x8_8x8x1_1x1_intrawave_v3
192,4096,1024,47,0,11.4518,a8w8_rowwise_256x64x64x128_32x32_1x1_8x32x1_8x32x1_1x32x1x8_8x8x1_1x1_intrawave_v3
256,4096,1024,45,0,13.6408,a8w8_rowwise_256x128x64x128_32x32_2x1_8x32x1_8x32x1_1x32x1x8_8x8x1_1x1_intrawave_v3
320,4096,1024,47,0,17.0563,a8w8_rowwise_256x64x64x128_32x32_1x1_8x32x1_8x32x1_1x32x1x8_8x8x1_1x1_intrawave_v3
512,4096,1024,13,0,21.4885,a8w8_rowwise_256x128x128x128_32x32_2x2_8x32x1_8x32x1_1x32x1x8_8x8x1_1x1_intrawave_v3
1024,4096,1024,13,0,40.5331,a8w8_rowwise_256x128x128x128_32x32_2x2_8x32x1_8x32x1_1x32x1x8_8x8x1_1x1_intrawave_v3
2048,4096,1024,13,0,79.9354,a8w8_rowwise_256x128x128x128_32x32_2x2_8x32x1_8x32x1_1x32x1x8_8x8x1_1x1_intrawave_v3
4096,4096,1024,13,0,154.3912,a8w8_rowwise_256x128x128x128_32x32_2x2_8x32x1_8x32x1_1x32x1x8_8x8x1_1x1_intrawave_v3
8192,4096,1024,13,0,301.8759,a8w8_rowwise_256x128x128x128_32x32_2x2_8x32x1_8x32x1_1x32x1x8_8x8x1_1x1_intrawave_v3
16384,4096,1024,13,0,595.8085,a8w8_rowwise_256x128x128x128_32x32_2x2_8x32x1_8x32x1_1x32x1x8_8x8x1_1x1_intrawave_v3
