ater/configs/tuned_gemm.csv
M,N,K,bias,dtype,outdtype,scaleAB,libtype,solidx,soltimes,kernelName
8,768,4096,False,torch.float8_e4m3fnuz,torch.bfloat16,True,hipblaslt,4423,8.09,Cijk_Alik_Bljk_F8BS_BH_SAB_UserArgs_MT16x32x512_MI16x16x1_SN_LDSB0_AFC0_AFEM1_AFEM8_ASEM32_CLR1_CADS0_DTVA0_EPS0_FDSI0_GRPM1_GRVWA16_GRVWB16_GSUAMB_GLS0_ISA942_IU1_K1_LBSPPA512_LBSPPB512_LBSPPM0_LPA32_LPB32_LPMn1_LRVW16_LWPMn1_MIAV0_MIWT1_1_MO40_NTn1_NTA0_NTB0_NTC0_NTD0_NTM0_NEPBS0_NLCA1_NLCB1_ONLL0_PGR2_PLR1_PKA1_SIA3_SS1_SPO0_SRVW0_SSO0_SVW1_TLDS1_ULSGRO0_USL1_UIOFGRO0_USFGROn1_VSn1_VWA1_VWB1_WSGRA0_WSGRB0_WG16_8_1
8,4096,512,False,torch.float8_e4m3fnuz,torch.bfloat16,True,hipblaslt,4489,5.05,Cijk_Alik_Bljk_F8BS_BH_SAB_UserArgs_MT32x16x128_MI16x16x1_SN_LDSB0_AFC0_AFEM1_AFEM8_ASEM32_CLR1_CADS0_DTVA0_EPS0_FDSI0_GRPM1_GRVWA16_GRVWB16_GSUAMB_GLS0_ISA942_IU1_K1_LBSPPA128_LBSPPB128_LBSPPM0_LPA32_LPB32_LPMn1_LRVW16_LWPMn1_MIAV0_MIWT1_1_MO40_NTn1_NTA0_NTB0_NTC0_NTD0_NTM0_NEPBS0_NLCA1_NLCB1_ONLL0_PGR2_PLR1_PKA1_SIA3_SS1_SPO0_SRVW0_SSO0_SVW1_TLDS1_ULSGRO0_USL1_UIOFGRO0_USFGROn1_VSn1_VWA1_VWB1_WSGRA0_WSGRB0_WG32_4_1
256,768,4096,False,torch.float8_e4m3fnuz,torch.bfloat16,True,hipblaslt,4436,16.05,Cijk_Alik_Bljk_F8BS_BH_SAB_UserArgs_MT64x48x256_MI16x16x1_SN_LDSB1_AFC0_AFEM1_AFEM8_ASEM32_CLR1_CADS0_DTVA0_EPS0_FDSI0_GRPM1_GRVWA16_GRVWB16_GSUAMB_GLS0_ISA942_IU1_K1_LBSPPA256_LBSPPB256_LBSPPM0_LPA32_LPB32_LPMn1_LRVW16_LWPMn1_MIAV0_MIWT1_3_MO40_NTn1_NTA0_NTB0_NTC0_NTD0_NTM0_NEPBS16_NLCA1_NLCB1_ONLL0_PGR2_PLR1_PKA1_SIA3_SS1_SPO0_SRVW0_SSO0_SVW1_TLDS1_ULSGRO0_USL1_UIOFGRO0_USFGROn1_VSn1_VWA1_VWB1_WSGRA0_WSGRB0_WG64_4_1
256,4096,512,False,torch.float8_e4m3fnuz,torch.bfloat16,True,hipblaslt,4455,9.67,Cijk_Alik_Bljk_F8BS_BH_SAB_UserArgs_MT128x128x128_MI16x16x1_SN_LDSB1_AFC0_AFEM8_AFEM8_ASEM32_CLR1_CADS0_DTVA0_EPS0_FDSI0_GRPM1_GRVWA16_GRVWB16_GSUAMB_GLS0_ISA942_IU1_K1_LBSPPA512_LBSPPB128_LBSPPM0_LPA32_LPB32_LPMn1_LRVW16_LWPMn1_MIAV0_MIWT4_4_MO40_NTn1_NTA0_NTB0_NTC0_NTD0_NTM0_NEPBS0_NLCA1_NLCB1_ONLL0_PGR2_PLR1_PKA1_SIA3_SS1_SPO0_SRVW0_SSO0_SVW4_TLDS1_ULSGRO0_USL1_UIOFGRO0_USFGROn1_VSn1_VWA4_VWB1_WSGRA0_WSGRB0_WG32_8_1
248,768,4096,False,torch.float8_e4m3fnuz,torch.bfloat16,True,hipblaslt,4436,16.04,Cijk_Alik_Bljk_F8BS_BH_SAB_UserArgs_MT64x48x256_MI16x16x1_SN_LDSB1_AFC0_AFEM1_AFEM8_ASEM32_CLR1_CADS0_DTVA0_EPS0_FDSI0_GRPM1_GRVWA16_GRVWB16_GSUAMB_GLS0_ISA942_IU1_K1_LBSPPA256_LBSPPB256_LBSPPM0_LPA32_LPB32_LPMn1_LRVW16_LWPMn1_MIAV0_MIWT1_3_MO40_NTn1_NTA0_NTB0_NTC0_NTD0_NTM0_NEPBS16_NLCA1_NLCB1_ONLL0_PGR2_PLR1_PKA1_SIA3_SS1_SPO0_SRVW0_SSO0_SVW1_TLDS1_ULSGRO0_USL1_UIOFGRO0_USFGROn1_VSn1_VWA1_VWB1_WSGRA0_WSGRB0_WG64_4_1
248,4096,512,False,torch.float8_e4m3fnuz,torch.bfloat16,True,hipblaslt,4389,9.99,Cijk_Alik_Bljk_F8BS_BH_SAB_UserArgs_MT128x128x128_MI16x16x1_SN_LDSB1_AFC0_AFEM8_AFEM8_ASEM32_CLR1_CADS0_DTVA0_EPS0_FDSI0_GRPM1_GRVWA16_GRVWB16_GSUAMB_GLS0_ISA942_IU1_K1_LBSPPA1024_LBSPPB128_LBSPPM0_LPA32_LPB32_LPMn1_LRVW16_LWPMn1_MIAV0_MIWT8_2_MO40_NTn1_NTA0_NTB0_NTC0_NTD0_NTM0_NEPBS16_NLCA1_NLCB1_ONLL0_PGR2_PLR1_PKA1_SIA3_SS1_SPO0_SRVW0_SSO0_SVW8_TLDS1_ULSGRO0_USL1_UIOFGRO0_USFGROn1_VSn1_VWA8_VWB1_WSGRA0_WSGRB0_WG16_16_1
240,768,4096,False,torch.float8_e4m3fnuz,torch.bfloat16,True,hipblaslt,4436,15.76,Cijk_Alik_Bljk_F8BS_BH_SAB_UserArgs_MT64x48x256_MI16x16x1_SN_LDSB1_AFC0_AFEM1_AFEM8_ASEM32_CLR1_CADS0_DTVA0_EPS0_FDSI0_GRPM1_GRVWA16_GRVWB16_GSUAMB_GLS0_ISA942_IU1_K1_LBSPPA256_LBSPPB256_LBSPPM0_LPA32_LPB32_LPMn1_LRVW16_LWPMn1_MIAV0_MIWT1_3_MO40_NTn1_NTA0_NTB0_NTC0_NTD0_NTM0_NEPBS16_NLCA1_NLCB1_ONLL0_PGR2_PLR1_PKA1_SIA3_SS1_SPO0_SRVW0_SSO0_SVW1_TLDS1_ULSGRO0_USL1_UIOFGRO0_USFGROn1_VSn1_VWA1_VWB1_WSGRA0_WSGRB0_WG64_4_1
240,4096,512,False,torch.float8_e4m3fnuz,torch.bfloat16,True,hipblaslt,4388,10.03,Cijk_Alik_Bljk_F8BS_BH_SAB_UserArgs_MT128x64x128_MI16x16x1_SN_LDSB1_AFC0_AFEM8_AFEM8_ASEM32_CLR1_CADS0_DTVA0_EPS0_FDSI0_GRPM1_GRVWA16_GRVWB16_GSUAMB_GLS0_ISA942_IU1_K1_LBSPPA512_LBSPPB128_LBSPPM0_LPA32_LPB32_LPMn1_LRVW16_LWPMn1_MIAV0_MIWT4_2_MO40_NTn1_NTA0_NTB0_NTC0_NTD0_NTM0_NEPBS16_NLCA1_NLCB1_ONLL0_PGR2_PLR1_PKA1_SIA3_SS1_SPO0_SRVW0_SSO0_SVW4_TLDS1_ULSGRO0_USL1_UIOFGRO0_USFGROn1_VSn1_VWA4_VWB1_WSGRA0_WSGRB0_WG32_8_1
232,768,4096,False,torch.float8_e4m3fnuz,torch.bfloat16,True,hipblaslt,4436,16.13,Cijk_Alik_Bljk_F8BS_BH_SAB_UserArgs_MT64x48x256_MI16x16x1_SN_LDSB1_AFC0_AFEM1_AFEM8_ASEM32_CLR1_CADS0_DTVA0_EPS0_FDSI0_GRPM1_GRVWA16_GRVWB16_GSUAMB_GLS0_ISA942_IU1_K1_LBSPPA256_LBSPPB256_LBSPPM0_LPA32_LPB32_LPMn1_LRVW16_LWPMn1_MIAV0_MIWT1_3_MO40_NTn1_NTA0_NTB0_NTC0_NTD0_NTM0_NEPBS16_NLCA1_NLCB1_ONLL0_PGR2_PLR1_PKA1_SIA3_SS1_SPO0_SRVW0_SSO0_SVW1_TLDS1_ULSGRO0_USL1_UIOFGRO0_USFGROn1_VSn1_VWA1_VWB1_WSGRA0_WSGRB0_WG64_4_1
232,4096,512,False,torch.float8_e4m3fnuz,torch.bfloat16,True,hipblaslt,4389,9.94,Cijk_Alik_Bljk_F8BS_BH_SAB_UserArgs_MT128x128x128_MI16x16x1_SN_LDSB1_AFC0_AFEM8_AFEM8_ASEM32_CLR1_CADS0_DTVA0_EPS0_FDSI0_GRPM1_GRVWA16_GRVWB16_GSUAMB_GLS0_ISA942_IU1_K1_LBSPPA1024_LBSPPB128_LBSPPM0_LPA32_LPB32_LPMn1_LRVW16_LWPMn1_MIAV0_MIWT8_2_MO40_NTn1_NTA0_NTB0_NTC0_NTD0_NTM0_NEPBS16_NLCA1_NLCB1_ONLL0_PGR2_PLR1_PKA1_SIA3_SS1_SPO0_SRVW0_SSO0_SVW8_TLDS1_ULSGRO0_USL1_UIOFGRO0_USFGROn1_VSn1_VWA8_VWB1_WSGRA0_WSGRB0_WG16_16_1
224,768,4096,False,torch.float8_e4m3fnuz,torch.bfloat16,True,hipblaslt,4436,16.08,Cijk_Alik_Bljk_F8BS_BH_SAB_UserArgs_MT64x48x256_MI16x16x1_SN_LDSB1_AFC0_AFEM1_AFEM8_ASEM32_CLR1_CADS0_DTVA0_EPS0_FDSI0_GRPM1_GRVWA16_GRVWB16_GSUAMB_GLS0_ISA942_IU1_K1_LBSPPA256_LBSPPB256_LBSPPM0_LPA32_LPB32_LPMn1_LRVW16_LWPMn1_MIAV0_MIWT1_3_MO40_NTn1_NTA0_NTB0_NTC0_NTD0_NTM0_NEPBS16_NLCA1_NLCB1_ONLL0_PGR2_PLR1_PKA1_SIA3_SS1_SPO0_SRVW0_SSO0_SVW1_TLDS1_ULSGRO0_USL1_UIOFGRO0_USFGROn1_VSn1_VWA1_VWB1_WSGRA0_WSGRB0_WG64_4_1
224,4096,512,False,torch.float8_e4m3fnuz,torch.bfloat16,True,hipblaslt,4429,9.94,Cijk_Alik_Bljk_F8BS_BH_SAB_UserArgs_MT128x128x128_MI16x16x1_SN_LDSB1_AFC0_AFEM8_AFEM8_ASEM32_CLR1_CADS0_DTVA0_EPS0_FDSI0_GRPM1_GRVWA16_GRVWB16_GSUAMB_GLS0_ISA942_IU1_K1_LBSPPA512_LBSPPB128_LBSPPM0_LPA32_LPB32_LPMn1_LRVW16_LWPMn1_MIAV0_MIWT4_4_MO40_NTn1_NTA0_NTB0_NTC0_NTD0_NTM0_NEPBS16_NLCA1_NLCB1_ONLL0_PGR2_PLR1_PKA1_SIA3_SS1_SPO0_SRVW0_SSO0_SVW4_TLDS1_ULSGRO0_USL1_UIOFGRO0_USFGROn1_VSn1_VWA4_VWB1_WSGRA0_WSGRB0_WG32_8_1
216,768,4096,False,torch.float8_e4m3fnuz,torch.bfloat16,True,hipblaslt,4436,16.03,Cijk_Alik_Bljk_F8BS_BH_SAB_UserArgs_MT64x48x256_MI16x16x1_SN_LDSB1_AFC0_AFEM1_AFEM8_ASEM32_CLR1_CADS0_DTVA0_EPS0_FDSI0_GRPM1_GRVWA16_GRVWB16_GSUAMB_GLS0_ISA942_IU1_K1_LBSPPA256_LBSPPB256_LBSPPM0_LPA32_LPB32_LPMn1_LRVW16_LWPMn1_MIAV0_MIWT1_3_MO40_NTn1_NTA0_NTB0_NTC0_NTD0_NTM0_NEPBS16_NLCA1_NLCB1_ONLL0_PGR2_PLR1_PKA1_SIA3_SS1_SPO0_SRVW0_SSO0_SVW1_TLDS1_ULSGRO0_USL1_UIOFGRO0_USFGROn1_VSn1_VWA1_VWB1_WSGRA0_WSGRB0_WG64_4_1
216,4096,512,False,torch.float8_e4m3fnuz,torch.bfloat16,True,hipblaslt,4501,9.97,Cijk_Alik_Bljk_F8BS_BH_SAB_UserArgs_MT128x128x128_MI16x16x1_SN_LDSB1_AFC0_AFEM8_AFEM8_ASEM32_CLR1_CADS0_DTVA0_EPS0_FDSI0_GRPM1_GRVWA16_GRVWB16_GSUAMB_GLS0_ISA942_IU1_K1_LBSPPA512_LBSPPB128_LBSPPM0_LPA32_LPB32_LPMn1_LRVW16_LWPMn1_MIAV0_MIWT4_4_MO40_NTn1_NTA0_NTB0_NTC0_NTD0_NTM0_NEPBS16_NLCA1_NLCB1_ONLL0_PGR2_PLR1_PKA1_SIA3_SS1_SPO0_SRVW0_SSO0_SVW4_TLDS1_ULSGRO0_USL1_UIOFGRO0_USFGROn1_VSn1_VWA4_VWB1_WSGRA0_WSGRB0_WG32_8_1
208,768,4096,False,torch.float8_e4m3fnuz,torch.bfloat16,True,hipblaslt,4413,15.82,Cijk_Alik_Bljk_F8BS_BH_SAB_UserArgs_MT128x16x256_MI16x16x1_SN_LDSB1_AFC0_AFEM8_AFEM1_ASEM32_CLR1_CADS0_DTVA0_EPS0_FDSI0_GRPM1_GRVWA16_GRVWB16_GSUAMB_GLS0_ISA942_IU1_K1_LBSPPA512_LBSPPB256_LBSPPM0_LPA32_LPB32_LPMn1_LRVW16_LWPMn1_MIAV0_MIWT2_1_MO40_NTn1_NTA0_NTB0_NTC0_NTD0_NTM0_NEPBS0_NLCA1_NLCB1_ONLL0_PGR2_PLR1_PKA1_SIA3_SS1_SPO0_SRVW0_SSO0_SVW2_TLDS1_ULSGRO0_USL1_UIOFGRO0_USFGROn1_VSn1_VWA2_VWB1_WSGRA0_WSGRB0_WG64_4_1
208,4096,512,False,torch.float8_e4m3fnuz,torch.bfloat16,True,hipblaslt,4429,9.87,Cijk_Alik_Bljk_F8BS_BH_SAB_UserArgs_MT128x128x128_MI16x16x1_SN_LDSB1_AFC0_AFEM8_AFEM8_ASEM32_CLR1_CADS0_DTVA0_EPS0_FDSI0_GRPM1_GRVWA16_GRVWB16_GSUAMB_GLS0_ISA942_IU1_K1_LBSPPA512_LBSPPB128_LBSPPM0_LPA32_LPB32_LPMn1_LRVW16_LWPMn1_MIAV0_MIWT4_4_MO40_NTn1_NTA0_NTB0_NTC0_NTD0_NTM0_NEPBS16_NLCA1_NLCB1_ONLL0_PGR2_PLR1_PKA1_SIA3_SS1_SPO0_SRVW0_SSO0_SVW4_TLDS1_ULSGRO0_USL1_UIOFGRO0_USFGROn1_VSn1_VWA4_VWB1_WSGRA0_WSGRB0_WG32_8_1
200,768,4096,False,torch.float8_e4m3fnuz,torch.bfloat16,True,hipblaslt,4436,15.94,Cijk_Alik_Bljk_F8BS_BH_SAB_UserArgs_MT64x48x256_MI16x16x1_SN_LDSB1_AFC0_AFEM1_AFEM8_ASEM32_CLR1_CADS0_DTVA0_EPS0_FDSI0_GRPM1_GRVWA16_GRVWB16_GSUAMB_GLS0_ISA942_IU1_K1_LBSPPA256_LBSPPB256_LBSPPM0_LPA32_LPB32_LPMn1_LRVW16_LWPMn1_MIAV0_MIWT1_3_MO40_NTn1_NTA0_NTB0_NTC0_NTD0_NTM0_NEPBS16_NLCA1_NLCB1_ONLL0_PGR2_PLR1_PKA1_SIA3_SS1_SPO0_SRVW0_SSO0_SVW1_TLDS1_ULSGRO0_USL1_UIOFGRO0_USFGROn1_VSn1_VWA1_VWB1_WSGRA0_WSGRB0_WG64_4_1
200,4096,512,False,torch.float8_e4m3fnuz,torch.bfloat16,True,hipblaslt,4501,9.91,Cijk_Alik_Bljk_F8BS_BH_SAB_UserArgs_MT128x128x128_MI16x16x1_SN_LDSB1_AFC0_AFEM8_AFEM8_ASEM32_CLR1_CADS0_DTVA0_EPS0_FDSI0_GRPM1_GRVWA16_GRVWB16_GSUAMB_GLS0_ISA942_IU1_K1_LBSPPA512_LBSPPB128_LBSPPM0_LPA32_LPB32_LPMn1_LRVW16_LWPMn1_MIAV0_MIWT4_4_MO40_NTn1_NTA0_NTB0_NTC0_NTD0_NTM0_NEPBS16_NLCA1_NLCB1_ONLL0_PGR2_PLR1_PKA1_SIA3_SS1_SPO0_SRVW0_SSO0_SVW4_TLDS1_ULSGRO0_USL1_UIOFGRO0_USFGROn1_VSn1_VWA4_VWB1_WSGRA0_WSGRB0_WG32_8_1
192,768,4096,False,torch.float8_e4m3fnuz,torch.bfloat16,True,hipblaslt,4514,13.58,Cijk_Alik_Bljk_F8BS_BH_SAB_UserArgs_MT32x64x256_MI16x16x1_SN_LDSB1_AFC0_AFEM8_AFEM8_ASEM32_CLR1_CADS0_DTVA0_EPS0_FDSI0_GRPM1_GRVWA16_GRVWB16_GSUAMB_GLS0_ISA942_IU1_K1_LBSPPA256_LBSPPB256_LBSPPM0_LPA32_LPB32_LPMn1_LRVW16_LWPMn1_MIAV0_MIWT1_2_MO40_NTn1_NTA0_NTB0_NTC0_NTD0_NTM0_NEPBS0_NLCA1_NLCB1_ONLL0_PGR2_PLR1_PKA1_SIA3_SS1_SPO0_SRVW0_SSO0_SVW1_TLDS1_ULSGRO0_USL1_UIOFGRO0_USFGROn1_VSn1_VWA1_VWB1_WSGRA0_WSGRB0_WG32_8_1
192,4096,512,False,torch.float8_e4m3fnuz,torch.bfloat16,True,hipblaslt,4391,8.43,Cijk_Alik_Bljk_F8BS_BH_SAB_UserArgs_MT128x96x128_MI16x16x1_SN_LDSB1_AFC0_AFEM8_AFEM8_ASEM32_CLR1_CADS0_DTVA0_EPS0_FDSI0_GRPM1_GRVWA16_GRVWB16_GSUAMB_GLS0_ISA942_IU1_K1_LBSPPA512_LBSPPB128_LBSPPM0_LPA32_LPB32_LPMn1_LRVW16_LWPMn1_MIAV0_MIWT4_3_MO40_NTn1_NTA0_NTB0_NTC0_NTD0_NTM0_NEPBS16_NLCA1_NLCB1_ONLL0_PGR2_PLR1_PKA1_SIA3_SS1_SPO0_SRVW0_SSO0_SVW4_TLDS1_ULSGRO0_USL1_UIOFGRO0_USFGROn1_VSn1_VWA4_VWB1_WSGRA0_WSGRB0_WG32_8_1
184,768,4096,False,torch.float8_e4m3fnuz,torch.bfloat16,True,hipblaslt,4322,13.56,Cijk_Alik_Bljk_F8BS_BH_SAB_UserArgs_MT64x32x512_MI16x16x1_SN_LDSB1_AFC0_AFEM8_AFEM1_ASEM32_CLR1_CADS0_DTVA0_EPS0_FDSI0_GRPM1_GRVWA16_GRVWB16_GSUAMB_GLS0_ISA942_IU1_K1_LBSPPA1024_LBSPPB512_LBSPPM0_LPA32_LPB32_LPMn1_LRVW16_LWPMn1_MIAV0_MIWT2_1_MO40_NTn1_NTA0_NTB0_NTC0_NTD0_NTM0_NEPBS0_NLCA1_NLCB1_ONLL0_PGR2_PLR1_PKA1_SIA3_SS1_SPO0_SRVW0_SSO0_SVW2_TLDS1_ULSGRO0_USL1_UIOFGRO0_USFGROn1_VSn1_VWA2_VWB1_WSGRA0_WSGRB0_WG32_8_1
184,4096,512,False,torch.float8_e4m3fnuz,torch.bfloat16,True,hipblaslt,4391,8.73,Cijk_Alik_Bljk_F8BS_BH_SAB_UserArgs_MT128x96x128_MI16x16x1_SN_LDSB1_AFC0_AFEM8_AFEM8_ASEM32_CLR1_CADS0_DTVA0_EPS0_FDSI0_GRPM1_GRVWA16_GRVWB16_GSUAMB_GLS0_ISA942_IU1_K1_LBSPPA512_LBSPPB128_LBSPPM0_LPA32_LPB32_LPMn1_LRVW16_LWPMn1_MIAV0_MIWT4_3_MO40_NTn1_NTA0_NTB0_NTC0_NTD0_NTM0_NEPBS16_NLCA1_NLCB1_ONLL0_PGR2_PLR1_PKA1_SIA3_SS1_SPO0_SRVW0_SSO0_SVW4_TLDS1_ULSGRO0_USL1_UIOFGRO0_USFGROn1_VSn1_VWA4_VWB1_WSGRA0_WSGRB0_WG32_8_1
176,768,4096,False,torch.float8_e4m3fnuz,torch.bfloat16,True,hipblaslt,4322,13.68,Cijk_Alik_Bljk_F8BS_BH_SAB_UserArgs_MT64x32x512_MI16x16x1_SN_LDSB1_AFC0_AFEM8_AFEM1_ASEM32_CLR1_CADS0_DTVA0_EPS0_FDSI0_GRPM1_GRVWA16_GRVWB16_GSUAMB_GLS0_ISA942_IU1_K1_LBSPPA1024_LBSPPB512_LBSPPM0_LPA32_LPB32_LPMn1_LRVW16_LWPMn1_MIAV0_MIWT2_1_MO40_NTn1_NTA0_NTB0_NTC0_NTD0_NTM0_NEPBS0_NLCA1_NLCB1_ONLL0_PGR2_PLR1_PKA1_SIA3_SS1_SPO0_SRVW0_SSO0_SVW2_TLDS1_ULSGRO0_USL1_UIOFGRO0_USFGROn1_VSn1_VWA2_VWB1_WSGRA0_WSGRB0_WG32_8_1
176,4096,512,False,torch.float8_e4m3fnuz,torch.bfloat16,True,hipblaslt,4391,8.69,Cijk_Alik_Bljk_F8BS_BH_SAB_UserArgs_MT128x96x128_MI16x16x1_SN_LDSB1_AFC0_AFEM8_AFEM8_ASEM32_CLR1_CADS0_DTVA0_EPS0_FDSI0_GRPM1_GRVWA16_GRVWB16_GSUAMB_GLS0_ISA942_IU1_K1_LBSPPA512_LBSPPB128_LBSPPM0_LPA32_LPB32_LPMn1_LRVW16_LWPMn1_MIAV0_MIWT4_3_MO40_NTn1_NTA0_NTB0_NTC0_NTD0_NTM0_NEPBS16_NLCA1_NLCB1_ONLL0_PGR2_PLR1_PKA1_SIA3_SS1_SPO0_SRVW0_SSO0_SVW4_TLDS1_ULSGRO0_USL1_UIOFGRO0_USFGROn1_VSn1_VWA4_VWB1_WSGRA0_WSGRB0_WG32_8_1
168,768,4096,False,torch.float8_e4m3fnuz,torch.bfloat16,True,hipblaslt,4514,13.74,Cijk_Alik_Bljk_F8BS_BH_SAB_UserArgs_MT32x64x256_MI16x16x1_SN_LDSB1_AFC0_AFEM8_AFEM8_ASEM32_CLR1_CADS0_DTVA0_EPS0_FDSI0_GRPM1_GRVWA16_GRVWB16_GSUAMB_GLS0_ISA942_IU1_K1_LBSPPA256_LBSPPB256_LBSPPM0_LPA32_LPB32_LPMn1_LRVW16_LWPMn1_MIAV0_MIWT1_2_MO40_NTn1_NTA0_NTB0_NTC0_NTD0_NTM0_NEPBS0_NLCA1_NLCB1_ONLL0_PGR2_PLR1_PKA1_SIA3_SS1_SPO0_SRVW0_SSO0_SVW1_TLDS1_ULSGRO0_USL1_UIOFGRO0_USFGROn1_VSn1_VWA1_VWB1_WSGRA0_WSGRB0_WG32_8_1
168,4096,512,False,torch.float8_e4m3fnuz,torch.bfloat16,True,hipblaslt,4391,8.67,Cijk_Alik_Bljk_F8BS_BH_SAB_UserArgs_MT128x96x128_MI16x16x1_SN_LDSB1_AFC0_AFEM8_AFEM8_ASEM32_CLR1_CADS0_DTVA0_EPS0_FDSI0_GRPM1_GRVWA16_GRVWB16_GSUAMB_GLS0_ISA942_IU1_K1_LBSPPA512_LBSPPB128_LBSPPM0_LPA32_LPB32_LPMn1_LRVW16_LWPMn1_MIAV0_MIWT4_3_MO40_NTn1_NTA0_NTB0_NTC0_NTD0_NTM0_NEPBS16_NLCA1_NLCB1_ONLL0_PGR2_PLR1_PKA1_SIA3_SS1_SPO0_SRVW0_SSO0_SVW4_TLDS1_ULSGRO0_USL1_UIOFGRO0_USFGROn1_VSn1_VWA4_VWB1_WSGRA0_WSGRB0_WG32_8_1
160,768,4096,False,torch.float8_e4m3fnuz,torch.bfloat16,True,hipblaslt,4322,13.47,Cijk_Alik_Bljk_F8BS_BH_SAB_UserArgs_MT64x32x512_MI16x16x1_SN_LDSB1_AFC0_AFEM8_AFEM1_ASEM32_CLR1_CADS0_DTVA0_EPS0_FDSI0_GRPM1_GRVWA16_GRVWB16_GSUAMB_GLS0_ISA942_IU1_K1_LBSPPA1024_LBSPPB512_LBSPPM0_LPA32_LPB32_LPMn1_LRVW16_LWPMn1_MIAV0_MIWT2_1_MO40_NTn1_NTA0_NTB0_NTC0_NTD0_NTM0_NEPBS0_NLCA1_NLCB1_ONLL0_PGR2_PLR1_PKA1_SIA3_SS1_SPO0_SRVW0_SSO0_SVW2_TLDS1_ULSGRO0_USL1_UIOFGRO0_USFGROn1_VSn1_VWA2_VWB1_WSGRA0_WSGRB0_WG32_8_1
160,4096,512,False,torch.float8_e4m3fnuz,torch.bfloat16,True,hipblaslt,4500,8.41,Cijk_Alik_Bljk_F8BS_BH_SAB_UserArgs_MT128x80x128_MI16x16x1_SN_LDSB1_AFC0_AFEM8_AFEM8_ASEM32_CLR1_CADS0_DTVA0_EPS0_FDSI0_GRPM1_GRVWA16_GRVWB8_GSUAMB_GLS0_ISA942_IU1_K1_LBSPPA256_LBSPPB128_LBSPPM0_LPA32_LPB32_LPMn1_LRVW16_LWPMn1_MIAV0_MIWT2_5_MO40_NTn1_NTA0_NTB0_NTC0_NTD0_NTM0_NEPBS16_NLCA1_NLCB1_ONLL0_PGR2_PLR1_PKA1_SIA3_SS1_SPO0_SRVW0_SSO0_SVW2_TLDS1_ULSGRO0_USL1_UIOFGRO0_USFGROn1_VSn1_VWA2_VWB1_WSGRA0_WSGRB0_WG64_4_1
152,768,4096,False,torch.float8_e4m3fnuz,torch.bfloat16,True,hipblaslt,4322,13.51,Cijk_Alik_Bljk_F8BS_BH_SAB_UserArgs_MT64x32x512_MI16x16x1_SN_LDSB1_AFC0_AFEM8_AFEM1_ASEM32_CLR1_CADS0_DTVA0_EPS0_FDSI0_GRPM1_GRVWA16_GRVWB16_GSUAMB_GLS0_ISA942_IU1_K1_LBSPPA1024_LBSPPB512_LBSPPM0_LPA32_LPB32_LPMn1_LRVW16_LWPMn1_MIAV0_MIWT2_1_MO40_NTn1_NTA0_NTB0_NTC0_NTD0_NTM0_NEPBS0_NLCA1_NLCB1_ONLL0_PGR2_PLR1_PKA1_SIA3_SS1_SPO0_SRVW0_SSO0_SVW2_TLDS1_ULSGRO0_USL1_UIOFGRO0_USFGROn1_VSn1_VWA2_VWB1_WSGRA0_WSGRB0_WG32_8_1
152,4096,512,False,torch.float8_e4m3fnuz,torch.bfloat16,True,hipblaslt,4391,8.51,Cijk_Alik_Bljk_F8BS_BH_SAB_UserArgs_MT128x96x128_MI16x16x1_SN_LDSB1_AFC0_AFEM8_AFEM8_ASEM32_CLR1_CADS0_DTVA0_EPS0_FDSI0_GRPM1_GRVWA16_GRVWB16_GSUAMB_GLS0_ISA942_IU1_K1_LBSPPA512_LBSPPB128_LBSPPM0_LPA32_LPB32_LPMn1_LRVW16_LWPMn1_MIAV0_MIWT4_3_MO40_NTn1_NTA0_NTB0_NTC0_NTD0_NTM0_NEPBS16_NLCA1_NLCB1_ONLL0_PGR2_PLR1_PKA1_SIA3_SS1_SPO0_SRVW0_SSO0_SVW4_TLDS1_ULSGRO0_USL1_UIOFGRO0_USFGROn1_VSn1_VWA4_VWB1_WSGRA0_WSGRB0_WG32_8_1
144,768,4096,False,torch.float8_e4m3fnuz,torch.bfloat16,True,hipblaslt,4322,13.51,Cijk_Alik_Bljk_F8BS_BH_SAB_UserArgs_MT64x32x512_MI16x16x1_SN_LDSB1_AFC0_AFEM8_AFEM1_ASEM32_CLR1_CADS0_DTVA0_EPS0_FDSI0_GRPM1_GRVWA16_GRVWB16_GSUAMB_GLS0_ISA942_IU1_K1_LBSPPA1024_LBSPPB512_LBSPPM0_LPA32_LPB32_LPMn1_LRVW16_LWPMn1_MIAV0_MIWT2_1_MO40_NTn1_NTA0_NTB0_NTC0_NTD0_NTM0_NEPBS0_NLCA1_NLCB1_ONLL0_PGR2_PLR1_PKA1_SIA3_SS1_SPO0_SRVW0_SSO0_SVW2_TLDS1_ULSGRO0_USL1_UIOFGRO0_USFGROn1_VSn1_VWA2_VWB1_WSGRA0_WSGRB0_WG32_8_1
144,4096,512,False,torch.float8_e4m3fnuz,torch.bfloat16,True,hipblaslt,4391,8.47,Cijk_Alik_Bljk_F8BS_BH_SAB_UserArgs_MT128x96x128_MI16x16x1_SN_LDSB1_AFC0_AFEM8_AFEM8_ASEM32_CLR1_CADS0_DTVA0_EPS0_FDSI0_GRPM1_GRVWA16_GRVWB16_GSUAMB_GLS0_ISA942_IU1_K1_LBSPPA512_LBSPPB128_LBSPPM0_LPA32_LPB32_LPMn1_LRVW16_LWPMn1_MIAV0_MIWT4_3_MO40_NTn1_NTA0_NTB0_NTC0_NTD0_NTM0_NEPBS16_NLCA1_NLCB1_ONLL0_PGR2_PLR1_PKA1_SIA3_SS1_SPO0_SRVW0_SSO0_SVW4_TLDS1_ULSGRO0_USL1_UIOFGRO0_USFGROn1_VSn1_VWA4_VWB1_WSGRA0_WSGRB0_WG32_8_1
136,768,4096,False,torch.float8_e4m3fnuz,torch.bfloat16,True,hipblaslt,4322,13.52,Cijk_Alik_Bljk_F8BS_BH_SAB_UserArgs_MT64x32x512_MI16x16x1_SN_LDSB1_AFC0_AFEM8_AFEM1_ASEM32_CLR1_CADS0_DTVA0_EPS0_FDSI0_GRPM1_GRVWA16_GRVWB16_GSUAMB_GLS0_ISA942_IU1_K1_LBSPPA1024_LBSPPB512_LBSPPM0_LPA32_LPB32_LPMn1_LRVW16_LWPMn1_MIAV0_MIWT2_1_MO40_NTn1_NTA0_NTB0_NTC0_NTD0_NTM0_NEPBS0_NLCA1_NLCB1_ONLL0_PGR2_PLR1_PKA1_SIA3_SS1_SPO0_SRVW0_SSO0_SVW2_TLDS1_ULSGRO0_USL1_UIOFGRO0_USFGROn1_VSn1_VWA2_VWB1_WSGRA0_WSGRB0_WG32_8_1
136,4096,512,False,torch.float8_e4m3fnuz,torch.bfloat16,True,hipblaslt,4391,8.48,Cijk_Alik_Bljk_F8BS_BH_SAB_UserArgs_MT128x96x128_MI16x16x1_SN_LDSB1_AFC0_AFEM8_AFEM8_ASEM32_CLR1_CADS0_DTVA0_EPS0_FDSI0_GRPM1_GRVWA16_GRVWB16_GSUAMB_GLS0_ISA942_IU1_K1_LBSPPA512_LBSPPB128_LBSPPM0_LPA32_LPB32_LPMn1_LRVW16_LWPMn1_MIAV0_MIWT4_3_MO40_NTn1_NTA0_NTB0_NTC0_NTD0_NTM0_NEPBS16_NLCA1_NLCB1_ONLL0_PGR2_PLR1_PKA1_SIA3_SS1_SPO0_SRVW0_SSO0_SVW4_TLDS1_ULSGRO0_USL1_UIOFGRO0_USFGROn1_VSn1_VWA4_VWB1_WSGRA0_WSGRB0_WG32_8_1
128,768,4096,False,torch.float8_e4m3fnuz,torch.bfloat16,True,hipblaslt,4322,13.27,Cijk_Alik_Bljk_F8BS_BH_SAB_UserArgs_MT64x32x512_MI16x16x1_SN_LDSB1_AFC0_AFEM8_AFEM1_ASEM32_CLR1_CADS0_DTVA0_EPS0_FDSI0_GRPM1_GRVWA16_GRVWB16_GSUAMB_GLS0_ISA942_IU1_K1_LBSPPA1024_LBSPPB512_LBSPPM0_LPA32_LPB32_LPMn1_LRVW16_LWPMn1_MIAV0_MIWT2_1_MO40_NTn1_NTA0_NTB0_NTC0_NTD0_NTM0_NEPBS0_NLCA1_NLCB1_ONLL0_PGR2_PLR1_PKA1_SIA3_SS1_SPO0_SRVW0_SSO0_SVW2_TLDS1_ULSGRO0_USL1_UIOFGRO0_USFGROn1_VSn1_VWA2_VWB1_WSGRA0_WSGRB0_WG32_8_1
128,4096,512,False,torch.float8_e4m3fnuz,torch.bfloat16,True,hipblaslt,4417,7.28,Cijk_Alik_Bljk_F8BS_BH_SAB_UserArgs_MT64x64x128_MI16x16x1_SN_LDSB1_AFC0_AFEM1_AFEM8_ASEM32_CLR1_CADS0_DTVA0_EPS0_FDSI0_GRPM1_GRVWA16_GRVWB16_GSUAMB_GLS0_ISA942_IU1_K1_LBSPPA256_LBSPPB128_LBSPPM0_LPA32_LPB32_LPMn1_LRVW16_LWPMn1_MIAV0_MIWT2_2_MO40_NTn1_NTA0_NTB0_NTC0_NTD0_NTM0_NEPBS16_NLCA1_NLCB1_ONLL0_PGR2_PLR1_PKA1_SIA3_SS1_SPO0_SRVW0_SSO0_SVW2_TLDS1_ULSGRO0_USL1_UIOFGRO0_USFGROn1_VSn1_VWA2_VWB1_WSGRA0_WSGRB0_WG32_8_1
120,768,4096,False,torch.float8_e4m3fnuz,torch.bfloat16,True,hipblaslt,4322,13.37,Cijk_Alik_Bljk_F8BS_BH_SAB_UserArgs_MT64x32x512_MI16x16x1_SN_LDSB1_AFC0_AFEM8_AFEM1_ASEM32_CLR1_CADS0_DTVA0_EPS0_FDSI0_GRPM1_GRVWA16_GRVWB16_GSUAMB_GLS0_ISA942_IU1_K1_LBSPPA1024_LBSPPB512_LBSPPM0_LPA32_LPB32_LPMn1_LRVW16_LWPMn1_MIAV0_MIWT2_1_MO40_NTn1_NTA0_NTB0_NTC0_NTD0_NTM0_NEPBS0_NLCA1_NLCB1_ONLL0_PGR2_PLR1_PKA1_SIA3_SS1_SPO0_SRVW0_SSO0_SVW2_TLDS1_ULSGRO0_USL1_UIOFGRO0_USFGROn1_VSn1_VWA2_VWB1_WSGRA0_WSGRB0_WG32_8_1
120,4096,512,False,torch.float8_e4m3fnuz,torch.bfloat16,True,hipblaslt,4410,7.38,Cijk_Alik_Bljk_F8BS_BH_SAB_UserArgs_MT64x128x128_MI16x16x1_SN_LDSB1_AFC0_AFEM8_AFEM8_ASEM32_CLR1_CADS0_DTVA0_EPS0_FDSI0_GRPM1_GRVWA16_GRVWB16_GSUAMB_GLS0_ISA942_IU1_K1_LBSPPA512_LBSPPB128_LBSPPM0_LPA32_LPB32_LPMn1_LRVW16_LWPMn1_MIAV0_MIWT4_2_MO40_NTn1_NTA0_NTB0_NTC0_NTD0_NTM0_NEPBS0_NLCA1_NLCB1_ONLL0_PGR2_PLR1_PKA1_SIA3_SS1_SPO0_SRVW0_SSO0_SVW4_TLDS1_ULSGRO0_USL1_UIOFGRO0_USFGROn1_VSn1_VWA4_VWB1_WSGRA0_WSGRB0_WG16_16_1
112,768,4096,False,torch.float8_e4m3fnuz,torch.bfloat16,True,hipblaslt,4322,13.58,Cijk_Alik_Bljk_F8BS_BH_SAB_UserArgs_MT64x32x512_MI16x16x1_SN_LDSB1_AFC0_AFEM8_AFEM1_ASEM32_CLR1_CADS0_DTVA0_EPS0_FDSI0_GRPM1_GRVWA16_GRVWB16_GSUAMB_GLS0_ISA942_IU1_K1_LBSPPA1024_LBSPPB512_LBSPPM0_LPA32_LPB32_LPMn1_LRVW16_LWPMn1_MIAV0_MIWT2_1_MO40_NTn1_NTA0_NTB0_NTC0_NTD0_NTM0_NEPBS0_NLCA1_NLCB1_ONLL0_PGR2_PLR1_PKA1_SIA3_SS1_SPO0_SRVW0_SSO0_SVW2_TLDS1_ULSGRO0_USL1_UIOFGRO0_USFGROn1_VSn1_VWA2_VWB1_WSGRA0_WSGRB0_WG32_8_1
112,4096,512,False,torch.float8_e4m3fnuz,torch.bfloat16,True,hipblaslt,4410,7.37,Cijk_Alik_Bljk_F8BS_BH_SAB_UserArgs_MT64x128x128_MI16x16x1_SN_LDSB1_AFC0_AFEM8_AFEM8_ASEM32_CLR1_CADS0_DTVA0_EPS0_FDSI0_GRPM1_GRVWA16_GRVWB16_GSUAMB_GLS0_ISA942_IU1_K1_LBSPPA512_LBSPPB128_LBSPPM0_LPA32_LPB32_LPMn1_LRVW16_LWPMn1_MIAV0_MIWT4_2_MO40_NTn1_NTA0_NTB0_NTC0_NTD0_NTM0_NEPBS0_NLCA1_NLCB1_ONLL0_PGR2_PLR1_PKA1_SIA3_SS1_SPO0_SRVW0_SSO0_SVW4_TLDS1_ULSGRO0_USL1_UIOFGRO0_USFGROn1_VSn1_VWA4_VWB1_WSGRA0_WSGRB0_WG16_16_1
104,768,4096,False,torch.float8_e4m3fnuz,torch.bfloat16,True,hipblaslt,118153,13.4,Cijk_Alik_Bljk_F8BS_BH_BiasSB_HAS_SAB_SAV_UserArgs_MT64x64x256_MI16x16x1_SN_LDSB1_AFC1_AFEM1_AFEM1_ASEM1_CLR1_CADS0_DTVA0_EPS0_FDSI0_GRPM1_GRVWA16_GRVWB16_GSUAMBSK_GLS0_ISA942_IU1_K1_LBSPPA1024_LBSPPB256_LBSPPM0_LPA32_LPB32_LPM0_LRVW16_LWPMn1_MIAV0_MIWT4_1_MO40_NTn1_NTA0_NTB0_NTC0_NTD0_NTM0_NEPBS16_NLCA1_NLCB1_ONLL0_PGR2_PLR1_PKA1_SIA3_SS1_SPO0_SRVW0_SSO0_SVW4_TLDS1_ULSGRO0_USL1_UIOFGRO0_USFGROn1_VSn1_VWA4_VWB1_WSGRA0_WSGRB0_WG16_16_1
104,4096,512,False,torch.float8_e4m3fnuz,torch.bfloat16,True,hipblaslt,4410,7.36,Cijk_Alik_Bljk_F8BS_BH_SAB_UserArgs_MT64x128x128_MI16x16x1_SN_LDSB1_AFC0_AFEM8_AFEM8_ASEM32_CLR1_CADS0_DTVA0_EPS0_FDSI0_GRPM1_GRVWA16_GRVWB16_GSUAMB_GLS0_ISA942_IU1_K1_LBSPPA512_LBSPPB128_LBSPPM0_LPA32_LPB32_LPMn1_LRVW16_LWPMn1_MIAV0_MIWT4_2_MO40_NTn1_NTA0_NTB0_NTC0_NTD0_NTM0_NEPBS0_NLCA1_NLCB1_ONLL0_PGR2_PLR1_PKA1_SIA3_SS1_SPO0_SRVW0_SSO0_SVW4_TLDS1_ULSGRO0_USL1_UIOFGRO0_USFGROn1_VSn1_VWA4_VWB1_WSGRA0_WSGRB0_WG16_16_1
96,768,4096,False,torch.float8_e4m3fnuz,torch.bfloat16,True,hipblaslt,4491,9.83,Cijk_Alik_Bljk_F8BS_BH_SAB_UserArgs_MT32x32x256_MI16x16x1_SN_LDSB0_AFC0_AFEM8_AFEM8_ASEM32_CLR1_CADS0_DTVA0_EPS0_FDSI0_GRPM1_GRVWA16_GRVWB16_GSUAMB_GLS0_ISA942_IU1_K1_LBSPPA256_LBSPPB256_LBSPPM0_LPA32_LPB32_LPMn1_LRVW16_LWPMn1_MIAV0_MIWT1_1_MO40_NTn1_NTA0_NTB0_NTC0_NTD0_NTM0_NEPBS16_NLCA1_NLCB1_ONLL0_PGR2_PLR1_PKA1_SIA3_SS1_SPO0_SRVW0_SSO0_SVW1_TLDS1_ULSGRO0_USL1_UIOFGRO0_USFGROn1_VSn1_VWA1_VWB1_WSGRA0_WSGRB0_WG32_8_1
96,4096,512,False,torch.float8_e4m3fnuz,torch.bfloat16,True,hipblaslt,4385,6.5,Cijk_Alik_Bljk_F8BS_BH_SAB_UserArgs_MT64x96x128_MI16x16x1_SN_LDSB1_AFC0_AFEM8_AFEM8_ASEM32_CLR1_CADS0_DTVA0_EPS0_FDSI0_GRPM1_GRVWA16_GRVWB16_GSUAMB_GLS0_ISA942_IU1_K1_LBSPPA256_LBSPPB128_LBSPPM0_LPA32_LPB32_LPMn1_LRVW16_LWPMn1_MIAV0_MIWT2_3_MO40_NTn1_NTA0_NTB0_NTC0_NTD0_NTM0_NEPBS16_NLCA1_NLCB1_ONLL0_PGR2_PLR1_PKA1_SIA3_SS1_SPO0_SRVW0_SSO0_SVW2_TLDS1_ULSGRO0_USL1_UIOFGRO0_USFGROn1_VSn1_VWA2_VWB1_WSGRA0_WSGRB0_WG32_8_1
88,768,4096,False,torch.float8_e4m3fnuz,torch.bfloat16,True,hipblaslt,4491,9.95,Cijk_Alik_Bljk_F8BS_BH_SAB_UserArgs_MT32x32x256_MI16x16x1_SN_LDSB0_AFC0_AFEM8_AFEM8_ASEM32_CLR1_CADS0_DTVA0_EPS0_FDSI0_GRPM1_GRVWA16_GRVWB16_GSUAMB_GLS0_ISA942_IU1_K1_LBSPPA256_LBSPPB256_LBSPPM0_LPA32_LPB32_LPMn1_LRVW16_LWPMn1_MIAV0_MIWT1_1_MO40_NTn1_NTA0_NTB0_NTC0_NTD0_NTM0_NEPBS16_NLCA1_NLCB1_ONLL0_PGR2_PLR1_PKA1_SIA3_SS1_SPO0_SRVW0_SSO0_SVW1_TLDS1_ULSGRO0_USL1_UIOFGRO0_USFGROn1_VSn1_VWA1_VWB1_WSGRA0_WSGRB0_WG32_8_1
88,4096,512,False,torch.float8_e4m3fnuz,torch.bfloat16,True,hipblaslt,4385,6.83,Cijk_Alik_Bljk_F8BS_BH_SAB_UserArgs_MT64x96x128_MI16x16x1_SN_LDSB1_AFC0_AFEM8_AFEM8_ASEM32_CLR1_CADS0_DTVA0_EPS0_FDSI0_GRPM1_GRVWA16_GRVWB16_GSUAMB_GLS0_ISA942_IU1_K1_LBSPPA256_LBSPPB128_LBSPPM0_LPA32_LPB32_LPMn1_LRVW16_LWPMn1_MIAV0_MIWT2_3_MO40_NTn1_NTA0_NTB0_NTC0_NTD0_NTM0_NEPBS16_NLCA1_NLCB1_ONLL0_PGR2_PLR1_PKA1_SIA3_SS1_SPO0_SRVW0_SSO0_SVW2_TLDS1_ULSGRO0_USL1_UIOFGRO0_USFGROn1_VSn1_VWA2_VWB1_WSGRA0_WSGRB0_WG32_8_1
80,768,4096,False,torch.float8_e4m3fnuz,torch.bfloat16,True,hipblaslt,4491,9.94,Cijk_Alik_Bljk_F8BS_BH_SAB_UserArgs_MT32x32x256_MI16x16x1_SN_LDSB0_AFC0_AFEM8_AFEM8_ASEM32_CLR1_CADS0_DTVA0_EPS0_FDSI0_GRPM1_GRVWA16_GRVWB16_GSUAMB_GLS0_ISA942_IU1_K1_LBSPPA256_LBSPPB256_LBSPPM0_LPA32_LPB32_LPMn1_LRVW16_LWPMn1_MIAV0_MIWT1_1_MO40_NTn1_NTA0_NTB0_NTC0_NTD0_NTM0_NEPBS16_NLCA1_NLCB1_ONLL0_PGR2_PLR1_PKA1_SIA3_SS1_SPO0_SRVW0_SSO0_SVW1_TLDS1_ULSGRO0_USL1_UIOFGRO0_USFGROn1_VSn1_VWA1_VWB1_WSGRA0_WSGRB0_WG32_8_1
80,4096,512,False,torch.float8_e4m3fnuz,torch.bfloat16,True,hipblaslt,4385,7.06,Cijk_Alik_Bljk_F8BS_BH_SAB_UserArgs_MT64x96x128_MI16x16x1_SN_LDSB1_AFC0_AFEM8_AFEM8_ASEM32_CLR1_CADS0_DTVA0_EPS0_FDSI0_GRPM1_GRVWA16_GRVWB16_GSUAMB_GLS0_ISA942_IU1_K1_LBSPPA256_LBSPPB128_LBSPPM0_LPA32_LPB32_LPMn1_LRVW16_LWPMn1_MIAV0_MIWT2_3_MO40_NTn1_NTA0_NTB0_NTC0_NTD0_NTM0_NEPBS16_NLCA1_NLCB1_ONLL0_PGR2_PLR1_PKA1_SIA3_SS1_SPO0_SRVW0_SSO0_SVW2_TLDS1_ULSGRO0_USL1_UIOFGRO0_USFGROn1_VSn1_VWA2_VWB1_WSGRA0_WSGRB0_WG32_8_1
72,768,4096,False,torch.float8_e4m3fnuz,torch.bfloat16,True,hipblaslt,4491,9.91,Cijk_Alik_Bljk_F8BS_BH_SAB_UserArgs_MT32x32x256_MI16x16x1_SN_LDSB0_AFC0_AFEM8_AFEM8_ASEM32_CLR1_CADS0_DTVA0_EPS0_FDSI0_GRPM1_GRVWA16_GRVWB16_GSUAMB_GLS0_ISA942_IU1_K1_LBSPPA256_LBSPPB256_LBSPPM0_LPA32_LPB32_LPMn1_LRVW16_LWPMn1_MIAV0_MIWT1_1_MO40_NTn1_NTA0_NTB0_NTC0_NTD0_NTM0_NEPBS16_NLCA1_NLCB1_ONLL0_PGR2_PLR1_PKA1_SIA3_SS1_SPO0_SRVW0_SSO0_SVW1_TLDS1_ULSGRO0_USL1_UIOFGRO0_USFGROn1_VSn1_VWA1_VWB1_WSGRA0_WSGRB0_WG32_8_1
72,4096,512,False,torch.float8_e4m3fnuz,torch.bfloat16,True,hipblaslt,4385,6.84,Cijk_Alik_Bljk_F8BS_BH_SAB_UserArgs_MT64x96x128_MI16x16x1_SN_LDSB1_AFC0_AFEM8_AFEM8_ASEM32_CLR1_CADS0_DTVA0_EPS0_FDSI0_GRPM1_GRVWA16_GRVWB16_GSUAMB_GLS0_ISA942_IU1_K1_LBSPPA256_LBSPPB128_LBSPPM0_LPA32_LPB32_LPMn1_LRVW16_LWPMn1_MIAV0_MIWT2_3_MO40_NTn1_NTA0_NTB0_NTC0_NTD0_NTM0_NEPBS16_NLCA1_NLCB1_ONLL0_PGR2_PLR1_PKA1_SIA3_SS1_SPO0_SRVW0_SSO0_SVW2_TLDS1_ULSGRO0_USL1_UIOFGRO0_USFGROn1_VSn1_VWA2_VWB1_WSGRA0_WSGRB0_WG32_8_1
64,768,4096,False,torch.float8_e4m3fnuz,torch.bfloat16,True,hipblaslt,4491,9.69,Cijk_Alik_Bljk_F8BS_BH_SAB_UserArgs_MT32x32x256_MI16x16x1_SN_LDSB0_AFC0_AFEM8_AFEM8_ASEM32_CLR1_CADS0_DTVA0_EPS0_FDSI0_GRPM1_GRVWA16_GRVWB16_GSUAMB_GLS0_ISA942_IU1_K1_LBSPPA256_LBSPPB256_LBSPPM0_LPA32_LPB32_LPMn1_LRVW16_LWPMn1_MIAV0_MIWT1_1_MO40_NTn1_NTA0_NTB0_NTC0_NTD0_NTM0_NEPBS16_NLCA1_NLCB1_ONLL0_PGR2_PLR1_PKA1_SIA3_SS1_SPO0_SRVW0_SSO0_SVW1_TLDS1_ULSGRO0_USL1_UIOFGRO0_USFGROn1_VSn1_VWA1_VWB1_WSGRA0_WSGRB0_WG32_8_1
64,4096,512,False,torch.float8_e4m3fnuz,torch.bfloat16,True,hipblaslt,4417,5.98,Cijk_Alik_Bljk_F8BS_BH_SAB_UserArgs_MT64x64x128_MI16x16x1_SN_LDSB1_AFC0_AFEM1_AFEM8_ASEM32_CLR1_CADS0_DTVA0_EPS0_FDSI0_GRPM1_GRVWA16_GRVWB16_GSUAMB_GLS0_ISA942_IU1_K1_LBSPPA256_LBSPPB128_LBSPPM0_LPA32_LPB32_LPMn1_LRVW16_LWPMn1_MIAV0_MIWT2_2_MO40_NTn1_NTA0_NTB0_NTC0_NTD0_NTM0_NEPBS16_NLCA1_NLCB1_ONLL0_PGR2_PLR1_PKA1_SIA3_SS1_SPO0_SRVW0_SSO0_SVW2_TLDS1_ULSGRO0_USL1_UIOFGRO0_USFGROn1_VSn1_VWA2_VWB1_WSGRA0_WSGRB0_WG32_8_1
56,768,4096,False,torch.float8_e4m3fnuz,torch.bfloat16,True,hipblaslt,4491,9.81,Cijk_Alik_Bljk_F8BS_BH_SAB_UserArgs_MT32x32x256_MI16x16x1_SN_LDSB0_AFC0_AFEM8_AFEM8_ASEM32_CLR1_CADS0_DTVA0_EPS0_FDSI0_GRPM1_GRVWA16_GRVWB16_GSUAMB_GLS0_ISA942_IU1_K1_LBSPPA256_LBSPPB256_LBSPPM0_LPA32_LPB32_LPMn1_LRVW16_LWPMn1_MIAV0_MIWT1_1_MO40_NTn1_NTA0_NTB0_NTC0_NTD0_NTM0_NEPBS16_NLCA1_NLCB1_ONLL0_PGR2_PLR1_PKA1_SIA3_SS1_SPO0_SRVW0_SSO0_SVW1_TLDS1_ULSGRO0_USL1_UIOFGRO0_USFGROn1_VSn1_VWA1_VWB1_WSGRA0_WSGRB0_WG32_8_1
56,4096,512,False,torch.float8_e4m3fnuz,torch.bfloat16,True,hipblaslt,4417,5.97,Cijk_Alik_Bljk_F8BS_BH_SAB_UserArgs_MT64x64x128_MI16x16x1_SN_LDSB1_AFC0_AFEM1_AFEM8_ASEM32_CLR1_CADS0_DTVA0_EPS0_FDSI0_GRPM1_GRVWA16_GRVWB16_GSUAMB_GLS0_ISA942_IU1_K1_LBSPPA256_LBSPPB128_LBSPPM0_LPA32_LPB32_LPMn1_LRVW16_LWPMn1_MIAV0_MIWT2_2_MO40_NTn1_NTA0_NTB0_NTC0_NTD0_NTM0_NEPBS16_NLCA1_NLCB1_ONLL0_PGR2_PLR1_PKA1_SIA3_SS1_SPO0_SRVW0_SSO0_SVW2_TLDS1_ULSGRO0_USL1_UIOFGRO0_USFGROn1_VSn1_VWA2_VWB1_WSGRA0_WSGRB0_WG32_8_1
48,768,4096,False,torch.float8_e4m3fnuz,torch.bfloat16,True,hipblaslt,4351,8.77,Cijk_Alik_Bljk_F8BS_BH_SAB_UserArgs_MT32x16x256_MI16x16x1_SN_LDSB0_AFC0_AFEM8_AFEM8_ASEM32_CLR1_CADS0_DTVA0_EPS0_FDSI0_GRPM1_GRVWA16_GRVWB16_GSUAMB_GLS0_ISA942_IU1_K1_LBSPPA256_LBSPPB256_LBSPPM0_LPA32_LPB32_LPMn1_LRVW16_LWPMn1_MIAV0_MIWT1_1_MO40_NTn1_NTA0_NTB0_NTC0_NTD0_NTM0_NEPBS16_NLCA1_NLCB1_ONLL0_PGR2_PLR1_PKA1_SIA3_SS1_SPO0_SRVW0_SSO0_SVW1_TLDS1_ULSGRO0_USL1_UIOFGRO0_USFGROn1_VSn1_VWA1_VWB1_WSGRA0_WSGRB0_WG32_4_1
48,4096,512,False,torch.float8_e4m3fnuz,torch.bfloat16,True,hipblaslt,4436,5.88,Cijk_Alik_Bljk_F8BS_BH_SAB_UserArgs_MT64x48x256_MI16x16x1_SN_LDSB1_AFC0_AFEM1_AFEM8_ASEM32_CLR1_CADS0_DTVA0_EPS0_FDSI0_GRPM1_GRVWA16_GRVWB16_GSUAMB_GLS0_ISA942_IU1_K1_LBSPPA256_LBSPPB256_LBSPPM0_LPA32_LPB32_LPMn1_LRVW16_LWPMn1_MIAV0_MIWT1_3_MO40_NTn1_NTA0_NTB0_NTC0_NTD0_NTM0_NEPBS16_NLCA1_NLCB1_ONLL0_PGR2_PLR1_PKA1_SIA3_SS1_SPO0_SRVW0_SSO0_SVW1_TLDS1_ULSGRO0_USL1_UIOFGRO0_USFGROn1_VSn1_VWA1_VWB1_WSGRA0_WSGRB0_WG64_4_1
40,768,4096,False,torch.float8_e4m3fnuz,torch.bfloat16,True,hipblaslt,4345,8.71,Cijk_Alik_Bljk_F8BS_BH_SAB_UserArgs_MT32x16x256_MI16x16x1_SN_LDSB0_AFC0_AFEM8_AFEM8_ASEM32_CLR1_CADS0_DTVA0_EPS0_FDSI0_GRPM1_GRVWA16_GRVWB16_GSUAMB_GLS0_ISA942_IU1_K1_LBSPPA256_LBSPPB256_LBSPPM0_LPA32_LPB32_LPMn1_LRVW16_LWPMn1_MIAV0_MIWT1_1_MO40_NTn1_NTA0_NTB0_NTC0_NTD0_NTM0_NEPBS0_NLCA1_NLCB1_ONLL0_PGR2_PLR1_PKA1_SIA3_SS1_SPO0_SRVW0_SSO0_SVW1_TLDS1_ULSGRO0_USL1_UIOFGRO0_USFGROn1_VSn1_VWA1_VWB1_WSGRA0_WSGRB0_WG32_4_1
40,4096,512,False,torch.float8_e4m3fnuz,torch.bfloat16,True,hipblaslt,4473,5.98,Cijk_Alik_Bljk_F8BS_BH_SAB_UserArgs_MT64x64x128_MI16x16x1_SN_LDSB1_AFC0_AFEM8_AFEM8_ASEM32_CLR1_CADS0_DTVA0_EPS0_FDSI0_GRPM1_GRVWA16_GRVWB16_GSUAMB_GLS0_ISA942_IU1_K1_LBSPPA256_LBSPPB128_LBSPPM0_LPA32_LPB32_LPMn1_LRVW16_LWPMn1_MIAV0_MIWT2_2_MO40_NTn1_NTA0_NTB0_NTC0_NTD0_NTM0_NEPBS16_NLCA1_NLCB1_ONLL0_PGR2_PLR1_PKA1_SIA3_SS1_SPO0_SRVW0_SSO0_SVW2_TLDS1_ULSGRO0_USL1_UIOFGRO0_USFGROn1_VSn1_VWA2_VWB1_WSGRA0_WSGRB0_WG32_8_1
32,768,4096,False,torch.float8_e4m3fnuz,torch.bfloat16,True,hipblaslt,4423,8.03,Cijk_Alik_Bljk_F8BS_BH_SAB_UserArgs_MT16x32x512_MI16x16x1_SN_LDSB0_AFC0_AFEM1_AFEM8_ASEM32_CLR1_CADS0_DTVA0_EPS0_FDSI0_GRPM1_GRVWA16_GRVWB16_GSUAMB_GLS0_ISA942_IU1_K1_LBSPPA512_LBSPPB512_LBSPPM0_LPA32_LPB32_LPMn1_LRVW16_LWPMn1_MIAV0_MIWT1_1_MO40_NTn1_NTA0_NTB0_NTC0_NTD0_NTM0_NEPBS0_NLCA1_NLCB1_ONLL0_PGR2_PLR1_PKA1_SIA3_SS1_SPO0_SRVW0_SSO0_SVW1_TLDS1_ULSGRO0_USL1_UIOFGRO0_USFGROn1_VSn1_VWA1_VWB1_WSGRA0_WSGRB0_WG16_8_1
32,4096,512,False,torch.float8_e4m3fnuz,torch.bfloat16,True,hipblaslt,4424,5.02,Cijk_Alik_Bljk_F8BS_BH_SAB_UserArgs_MT64x32x128_MI16x16x1_SN_LDSB0_AFC0_AFEM8_AFEM8_ASEM32_CLR1_CADS0_DTVA0_EPS0_FDSI0_GRPM1_GRVWA16_GRVWB16_GSUAMB_GLS0_ISA942_IU1_K1_LBSPPA256_LBSPPB128_LBSPPM0_LPA32_LPB32_LPMn1_LRVW16_LWPMn1_MIAV0_MIWT2_1_MO40_NTn1_NTA0_NTB0_NTC0_NTD0_NTM0_NEPBS16_NLCA1_NLCB1_ONLL0_PGR2_PLR1_PKA1_SIA3_SS1_SPO0_SRVW0_SSO0_SVW2_TLDS1_ULSGRO0_USL1_UIOFGRO0_USFGROn1_VSn1_VWA2_VWB1_WSGRA0_WSGRB0_WG32_8_1
24,768,4096,False,torch.float8_e4m3fnuz,torch.bfloat16,True,hipblaslt,4479,8.07,Cijk_Alik_Bljk_F8BS_BH_SAB_UserArgs_MT16x32x512_MI16x16x1_SN_LDSB0_AFC0_AFEM8_AFEM8_ASEM32_CLR1_CADS0_DTVA0_EPS0_FDSI0_GRPM1_GRVWA16_GRVWB16_GSUAMB_GLS0_ISA942_IU1_K1_LBSPPA512_LBSPPB512_LBSPPM0_LPA32_LPB32_LPMn1_LRVW16_LWPMn1_MIAV0_MIWT1_1_MO40_NTn1_NTA0_NTB0_NTC0_NTD0_NTM0_NEPBS16_NLCA1_NLCB1_ONLL0_PGR2_PLR1_PKA1_SIA3_SS1_SPO0_SRVW0_SSO0_SVW1_TLDS1_ULSGRO0_USL1_UIOFGRO0_USFGROn1_VSn1_VWA1_VWB1_WSGRA0_WSGRB0_WG16_8_1
24,4096,512,False,torch.float8_e4m3fnuz,torch.bfloat16,True,hipblaslt,4419,5.24,Cijk_Alik_Bljk_F8BS_BH_SAB_UserArgs_MT64x32x128_MI16x16x1_SN_LDSB0_AFC0_AFEM1_AFEM8_ASEM32_CLR1_CADS0_DTVA0_EPS0_FDSI0_GRPM1_GRVWA16_GRVWB16_GSUAMB_GLS0_ISA942_IU1_K1_LBSPPA256_LBSPPB128_LBSPPM0_LPA32_LPB32_LPMn1_LRVW16_LWPMn1_MIAV0_MIWT2_1_MO40_NTn1_NTA0_NTB0_NTC0_NTD0_NTM0_NEPBS16_NLCA1_NLCB1_ONLL0_PGR2_PLR1_PKA1_SIA3_SS1_SPO0_SRVW0_SSO0_SVW2_TLDS1_ULSGRO0_USL1_UIOFGRO0_USFGROn1_VSn1_VWA2_VWB1_WSGRA0_WSGRB0_WG32_8_1
17,768,4096,False,torch.float8_e4m3fnuz,torch.bfloat16,True,hipblaslt,118012,8.81,Cijk_Alik_Bljk_F8BS_BH_BiasSB_HAS_SAB_SAV_UserArgs_MT32x16x512_MI16x16x1_SN_LDSB1_AFC1_AFEM1_AFEM1_ASEM1_CLR1_CADS0_DTVA0_EPS0_FDSI0_GRPM1_GRVWA16_GRVWB16_GSUAMB_GLS0_ISA942_IU1_K1_LBSPPA512_LBSPPB512_LBSPPM0_LPA32_LPB32_LPM0_LRVW16_LWPMn1_MIAV0_MIWT1_1_MO40_NTn1_NTA0_NTB0_NTC0_NTD0_NTM0_NEPBS16_NLCA1_NLCB1_ONLL0_PGR2_PLR1_PKA1_SIA3_SS1_SPO0_SRVW0_SSO0_SVW1_TLDS1_ULSGRO0_USL1_UIOFGRO0_USFGROn1_VSn1_VWA1_VWB1_WSGRA0_WSGRB0_WG32_4_1
17,4096,512,False,torch.float8_e4m3fnuz,torch.bfloat16,True,hipblaslt,4413,5.49,Cijk_Alik_Bljk_F8BS_BH_SAB_UserArgs_MT128x16x256_MI16x16x1_SN_LDSB1_AFC0_AFEM8_AFEM1_ASEM32_CLR1_CADS0_DTVA0_EPS0_FDSI0_GRPM1_GRVWA16_GRVWB16_GSUAMB_GLS0_ISA942_IU1_K1_LBSPPA512_LBSPPB256_LBSPPM0_LPA32_LPB32_LPMn1_LRVW16_LWPMn1_MIAV0_MIWT2_1_MO40_NTn1_NTA0_NTB0_NTC0_NTD0_NTM0_NEPBS0_NLCA1_NLCB1_ONLL0_PGR2_PLR1_PKA1_SIA3_SS1_SPO0_SRVW0_SSO0_SVW2_TLDS1_ULSGRO0_USL1_UIOFGRO0_USFGROn1_VSn1_VWA2_VWB1_WSGRA0_WSGRB0_WG64_4_1
256,8,4096,False,torch.bfloat16,torch.float32,False,hipblaslt,95833,8.61,Cijk_Alik_Bljk_BSS_BH_Bias_HAS_SAV_UserArgs_MT16x16x512_MI16x16x1_SN_LDSB1_AFC1_AFEM1_AFEM1_ASEM1_CLR1_CADS0_DTVA0_EPS0_FDSI0_GRPM1_GRVWA8_GRVWB8_GSUAMB_GLS0_ISA942_IU1_K1_LBSPPA1024_LBSPPB1024_LBSPPM0_LPA16_LPB16_LPM0_LRVW8_LWPMn1_MIAV1_MIWT1_1_MO40_NTn1_NTA0_NTB0_NTC0_NTD0_NTM0_NEPBS16_NLCA1_NLCB1_ONLL1_PGR2_PLR1_PKA1_SIA3_SS1_SPO0_SRVW0_SSO0_SVW1_TLDS1_ULSGRO0_USL1_UIOFGRO0_USFGROn1_VSn1_VWA1_VWB1_WSGRA0_WSGRB0_WG16_4_4
248,8,4096,False,torch.bfloat16,torch.float32,False,hipblaslt,95833,8.62,Cijk_Alik_Bljk_BSS_BH_Bias_HAS_SAV_UserArgs_MT16x16x512_MI16x16x1_SN_LDSB1_AFC1_AFEM1_AFEM1_ASEM1_CLR1_CADS0_DTVA0_EPS0_FDSI0_GRPM1_GRVWA8_GRVWB8_GSUAMB_GLS0_ISA942_IU1_K1_LBSPPA1024_LBSPPB1024_LBSPPM0_LPA16_LPB16_LPM0_LRVW8_LWPMn1_MIAV1_MIWT1_1_MO40_NTn1_NTA0_NTB0_NTC0_NTD0_NTM0_NEPBS16_NLCA1_NLCB1_ONLL1_PGR2_PLR1_PKA1_SIA3_SS1_SPO0_SRVW0_SSO0_SVW1_TLDS1_ULSGRO0_USL1_UIOFGRO0_USFGROn1_VSn1_VWA1_VWB1_WSGRA0_WSGRB0_WG16_4_4
240,8,4096,False,torch.bfloat16,torch.float32,False,hipblaslt,95833,8.62,Cijk_Alik_Bljk_BSS_BH_Bias_HAS_SAV_UserArgs_MT16x16x512_MI16x16x1_SN_LDSB1_AFC1_AFEM1_AFEM1_ASEM1_CLR1_CADS0_DTVA0_EPS0_FDSI0_GRPM1_GRVWA8_GRVWB8_GSUAMB_GLS0_ISA942_IU1_K1_LBSPPA1024_LBSPPB1024_LBSPPM0_LPA16_LPB16_LPM0_LRVW8_LWPMn1_MIAV1_MIWT1_1_MO40_NTn1_NTA0_NTB0_NTC0_NTD0_NTM0_NEPBS16_NLCA1_NLCB1_ONLL1_PGR2_PLR1_PKA1_SIA3_SS1_SPO0_SRVW0_SSO0_SVW1_TLDS1_ULSGRO0_USL1_UIOFGRO0_USFGROn1_VSn1_VWA1_VWB1_WSGRA0_WSGRB0_WG16_4_4
232,8,4096,False,torch.bfloat16,torch.float32,False,hipblaslt,95833,8.62,Cijk_Alik_Bljk_BSS_BH_Bias_HAS_SAV_UserArgs_MT16x16x512_MI16x16x1_SN_LDSB1_AFC1_AFEM1_AFEM1_ASEM1_CLR1_CADS0_DTVA0_EPS0_FDSI0_GRPM1_GRVWA8_GRVWB8_GSUAMB_GLS0_ISA942_IU1_K1_LBSPPA1024_LBSPPB1024_LBSPPM0_LPA16_LPB16_LPM0_LRVW8_LWPMn1_MIAV1_MIWT1_1_MO40_NTn1_NTA0_NTB0_NTC0_NTD0_NTM0_NEPBS16_NLCA1_NLCB1_ONLL1_PGR2_PLR1_PKA1_SIA3_SS1_SPO0_SRVW0_SSO0_SVW1_TLDS1_ULSGRO0_USL1_UIOFGRO0_USFGROn1_VSn1_VWA1_VWB1_WSGRA0_WSGRB0_WG16_4_4
224,8,4096,False,torch.bfloat16,torch.float32,False,hipblaslt,95833,8.63,Cijk_Alik_Bljk_BSS_BH_Bias_HAS_SAV_UserArgs_MT16x16x512_MI16x16x1_SN_LDSB1_AFC1_AFEM1_AFEM1_ASEM1_CLR1_CADS0_DTVA0_EPS0_FDSI0_GRPM1_GRVWA8_GRVWB8_GSUAMB_GLS0_ISA942_IU1_K1_LBSPPA1024_LBSPPB1024_LBSPPM0_LPA16_LPB16_LPM0_LRVW8_LWPMn1_MIAV1_MIWT1_1_MO40_NTn1_NTA0_NTB0_NTC0_NTD0_NTM0_NEPBS16_NLCA1_NLCB1_ONLL1_PGR2_PLR1_PKA1_SIA3_SS1_SPO0_SRVW0_SSO0_SVW1_TLDS1_ULSGRO0_USL1_UIOFGRO0_USFGROn1_VSn1_VWA1_VWB1_WSGRA0_WSGRB0_WG16_4_4
216,8,4096,False,torch.bfloat16,torch.float32,False,hipblaslt,98179,8.63,Cijk_Alik_Bljk_BSS_BH_Bias_HAS_SAV_UserArgs_MT16x16x512_MI16x16x1_SN_LDSB1_AFC1_AFEM1_AFEM1_ASEM1_CLR1_CADS0_DTVA0_EPS0_FDSI0_GRPM1_GRVWA8_GRVWB8_GSUAMB_GLS0_ISA942_IU1_K1_LBSPPA1024_LBSPPB1024_LBSPPM0_LPA16_LPB16_LPM0_LRVW8_LWPMn1_MIAV1_MIWT1_1_MO40_NTn1_NTA0_NTB0_NTC0_NTD0_NTM0_NEPBS16_NLCA1_NLCB1_ONLL1_PGR2_PLR1_PKA1_SIA3_SS1_SPO0_SRVW0_SSO0_SVW1_TLDS1_ULSGRO0_USL1_UIOFGRO0_USFGROn1_VSn1_VWA1_VWB1_WSGRA0_WSGRB0_WG16_4_4
208,8,4096,False,torch.bfloat16,torch.float32,False,hipblaslt,95833,8.6,Cijk_Alik_Bljk_BSS_BH_Bias_HAS_SAV_UserArgs_MT16x16x512_MI16x16x1_SN_LDSB1_AFC1_AFEM1_AFEM1_ASEM1_CLR1_CADS0_DTVA0_EPS0_FDSI0_GRPM1_GRVWA8_GRVWB8_GSUAMB_GLS0_ISA942_IU1_K1_LBSPPA1024_LBSPPB1024_LBSPPM0_LPA16_LPB16_LPM0_LRVW8_LWPMn1_MIAV1_MIWT1_1_MO40_NTn1_NTA0_NTB0_NTC0_NTD0_NTM0_NEPBS16_NLCA1_NLCB1_ONLL1_PGR2_PLR1_PKA1_SIA3_SS1_SPO0_SRVW0_SSO0_SVW1_TLDS1_ULSGRO0_USL1_UIOFGRO0_USFGROn1_VSn1_VWA1_VWB1_WSGRA0_WSGRB0_WG16_4_4
200,8,4096,False,torch.bfloat16,torch.float32,False,hipblaslt,95833,8.61,Cijk_Alik_Bljk_BSS_BH_Bias_HAS_SAV_UserArgs_MT16x16x512_MI16x16x1_SN_LDSB1_AFC1_AFEM1_AFEM1_ASEM1_CLR1_CADS0_DTVA0_EPS0_FDSI0_GRPM1_GRVWA8_GRVWB8_GSUAMB_GLS0_ISA942_IU1_K1_LBSPPA1024_LBSPPB1024_LBSPPM0_LPA16_LPB16_LPM0_LRVW8_LWPMn1_MIAV1_MIWT1_1_MO40_NTn1_NTA0_NTB0_NTC0_NTD0_NTM0_NEPBS16_NLCA1_NLCB1_ONLL1_PGR2_PLR1_PKA1_SIA3_SS1_SPO0_SRVW0_SSO0_SVW1_TLDS1_ULSGRO0_USL1_UIOFGRO0_USFGROn1_VSn1_VWA1_VWB1_WSGRA0_WSGRB0_WG16_4_4
192,8,4096,False,torch.bfloat16,torch.float32,False,hipblaslt,98367,8.63,Cijk_Alik_Bljk_BSS_BH_Bias_HAS_SAV_UserArgs_MT16x16x512_MI16x16x1_SN_LDSB1_AFC1_AFEM1_AFEM1_ASEM1_CLR1_CADS0_DTVA0_EPS0_FDSI0_GRPM1_GRVWA8_GRVWB8_GSUAMB_GLS0_ISA942_IU1_K1_LBSPPA1024_LBSPPB1024_LBSPPM0_LPA16_LPB16_LPM0_LRVW8_LWPMn1_MIAV1_MIWT1_1_MO40_NTn1_NTA0_NTB0_NTC0_NTD0_NTM0_NEPBS16_NLCA1_NLCB1_ONLL1_PGR2_PLR1_PKA1_SIA3_SS1_SPO0_SRVW0_SSO0_SVW1_TLDS1_ULSGRO0_USL1_UIOFGRO0_USFGROn1_VSn1_VWA1_VWB1_WSGRA0_WSGRB0_WG16_4_4
184,8,4096,False,torch.bfloat16,torch.float32,False,hipblaslt,98179,8.63,Cijk_Alik_Bljk_BSS_BH_Bias_HAS_SAV_UserArgs_MT16x16x512_MI16x16x1_SN_LDSB1_AFC1_AFEM1_AFEM1_ASEM1_CLR1_CADS0_DTVA0_EPS0_FDSI0_GRPM1_GRVWA8_GRVWB8_GSUAMB_GLS0_ISA942_IU1_K1_LBSPPA1024_LBSPPB1024_LBSPPM0_LPA16_LPB16_LPM0_LRVW8_LWPMn1_MIAV1_MIWT1_1_MO40_NTn1_NTA0_NTB0_NTC0_NTD0_NTM0_NEPBS16_NLCA1_NLCB1_ONLL1_PGR2_PLR1_PKA1_SIA3_SS1_SPO0_SRVW0_SSO0_SVW1_TLDS1_ULSGRO0_USL1_UIOFGRO0_USFGROn1_VSn1_VWA1_VWB1_WSGRA0_WSGRB0_WG16_4_4
176,8,4096,False,torch.bfloat16,torch.float32,False,hipblaslt,98367,8.61,Cijk_Alik_Bljk_BSS_BH_Bias_HAS_SAV_UserArgs_MT16x16x512_MI16x16x1_SN_LDSB1_AFC1_AFEM1_AFEM1_ASEM1_CLR1_CADS0_DTVA0_EPS0_FDSI0_GRPM1_GRVWA8_GRVWB8_GSUAMB_GLS0_ISA942_IU1_K1_LBSPPA1024_LBSPPB1024_LBSPPM0_LPA16_LPB16_LPM0_LRVW8_LWPMn1_MIAV1_MIWT1_1_MO40_NTn1_NTA0_NTB0_NTC0_NTD0_NTM0_NEPBS16_NLCA1_NLCB1_ONLL1_PGR2_PLR1_PKA1_SIA3_SS1_SPO0_SRVW0_SSO0_SVW1_TLDS1_ULSGRO0_USL1_UIOFGRO0_USFGROn1_VSn1_VWA1_VWB1_WSGRA0_WSGRB0_WG16_4_4
168,8,4096,False,torch.bfloat16,torch.float32,False,hipblaslt,95793,8.57,Cijk_Alik_Bljk_BSS_BH_Bias_HAS_SAV_UserArgs_MT16x16x512_MI16x16x1_SN_LDSB1_AFC1_AFEM1_AFEM1_ASEM1_CLR1_CADS0_DTVA0_EPS0_FDSI0_GRPM1_GRVWA8_GRVWB8_GSUAMB_GLS0_ISA942_IU1_K1_LBSPPA1024_LBSPPB1024_LBSPPM0_LPA16_LPB16_LPM0_LRVW8_LWPMn1_MIAV1_MIWT1_1_MO40_NTn1_NTA0_NTB0_NTC0_NTD0_NTM0_NEPBS16_NLCA1_NLCB1_ONLL1_PGR2_PLR1_PKA1_SIA3_SS1_SPO0_SRVW0_SSO0_SVW1_TLDS1_ULSGRO0_USL1_UIOFGRO0_USFGROn1_VSn1_VWA1_VWB1_WSGRA0_WSGRB0_WG16_4_4
160,8,4096,False,torch.bfloat16,torch.float32,False,hipblaslt,95833,8.61,Cijk_Alik_Bljk_BSS_BH_Bias_HAS_SAV_UserArgs_MT16x16x512_MI16x16x1_SN_LDSB1_AFC1_AFEM1_AFEM1_ASEM1_CLR1_CADS0_DTVA0_EPS0_FDSI0_GRPM1_GRVWA8_GRVWB8_GSUAMB_GLS0_ISA942_IU1_K1_LBSPPA1024_LBSPPB1024_LBSPPM0_LPA16_LPB16_LPM0_LRVW8_LWPMn1_MIAV1_MIWT1_1_MO40_NTn1_NTA0_NTB0_NTC0_NTD0_NTM0_NEPBS16_NLCA1_NLCB1_ONLL1_PGR2_PLR1_PKA1_SIA3_SS1_SPO0_SRVW0_SSO0_SVW1_TLDS1_ULSGRO0_USL1_UIOFGRO0_USFGROn1_VSn1_VWA1_VWB1_WSGRA0_WSGRB0_WG16_4_4
152,8,4096,False,torch.bfloat16,torch.float32,False,hipblaslt,95833,8.61,Cijk_Alik_Bljk_BSS_BH_Bias_HAS_SAV_UserArgs_MT16x16x512_MI16x16x1_SN_LDSB1_AFC1_AFEM1_AFEM1_ASEM1_CLR1_CADS0_DTVA0_EPS0_FDSI0_GRPM1_GRVWA8_GRVWB8_GSUAMB_GLS0_ISA942_IU1_K1_LBSPPA1024_LBSPPB1024_LBSPPM0_LPA16_LPB16_LPM0_LRVW8_LWPMn1_MIAV1_MIWT1_1_MO40_NTn1_NTA0_NTB0_NTC0_NTD0_NTM0_NEPBS16_NLCA1_NLCB1_ONLL1_PGR2_PLR1_PKA1_SIA3_SS1_SPO0_SRVW0_SSO0_SVW1_TLDS1_ULSGRO0_USL1_UIOFGRO0_USFGROn1_VSn1_VWA1_VWB1_WSGRA0_WSGRB0_WG16_4_4
144,8,4096,False,torch.bfloat16,torch.float32,False,hipblaslt,98367,8.6,Cijk_Alik_Bljk_BSS_BH_Bias_HAS_SAV_UserArgs_MT16x16x512_MI16x16x1_SN_LDSB1_AFC1_AFEM1_AFEM1_ASEM1_CLR1_CADS0_DTVA0_EPS0_FDSI0_GRPM1_GRVWA8_GRVWB8_GSUAMB_GLS0_ISA942_IU1_K1_LBSPPA1024_LBSPPB1024_LBSPPM0_LPA16_LPB16_LPM0_LRVW8_LWPMn1_MIAV1_MIWT1_1_MO40_NTn1_NTA0_NTB0_NTC0_NTD0_NTM0_NEPBS16_NLCA1_NLCB1_ONLL1_PGR2_PLR1_PKA1_SIA3_SS1_SPO0_SRVW0_SSO0_SVW1_TLDS1_ULSGRO0_USL1_UIOFGRO0_USFGROn1_VSn1_VWA1_VWB1_WSGRA0_WSGRB0_WG16_4_4
136,8,4096,False,torch.bfloat16,torch.float32,False,hipblaslt,95833,8.59,Cijk_Alik_Bljk_BSS_BH_Bias_HAS_SAV_UserArgs_MT16x16x512_MI16x16x1_SN_LDSB1_AFC1_AFEM1_AFEM1_ASEM1_CLR1_CADS0_DTVA0_EPS0_FDSI0_GRPM1_GRVWA8_GRVWB8_GSUAMB_GLS0_ISA942_IU1_K1_LBSPPA1024_LBSPPB1024_LBSPPM0_LPA16_LPB16_LPM0_LRVW8_LWPMn1_MIAV1_MIWT1_1_MO40_NTn1_NTA0_NTB0_NTC0_NTD0_NTM0_NEPBS16_NLCA1_NLCB1_ONLL1_PGR2_PLR1_PKA1_SIA3_SS1_SPO0_SRVW0_SSO0_SVW1_TLDS1_ULSGRO0_USL1_UIOFGRO0_USFGROn1_VSn1_VWA1_VWB1_WSGRA0_WSGRB0_WG16_4_4
128,8,4096,False,torch.bfloat16,torch.float32,False,hipblaslt,98179,8.57,Cijk_Alik_Bljk_BSS_BH_Bias_HAS_SAV_UserArgs_MT16x16x512_MI16x16x1_SN_LDSB1_AFC1_AFEM1_AFEM1_ASEM1_CLR1_CADS0_DTVA0_EPS0_FDSI0_GRPM1_GRVWA8_GRVWB8_GSUAMB_GLS0_ISA942_IU1_K1_LBSPPA1024_LBSPPB1024_LBSPPM0_LPA16_LPB16_LPM0_LRVW8_LWPMn1_MIAV1_MIWT1_1_MO40_NTn1_NTA0_NTB0_NTC0_NTD0_NTM0_NEPBS16_NLCA1_NLCB1_ONLL1_PGR2_PLR1_PKA1_SIA3_SS1_SPO0_SRVW0_SSO0_SVW1_TLDS1_ULSGRO0_USL1_UIOFGRO0_USFGROn1_VSn1_VWA1_VWB1_WSGRA0_WSGRB0_WG16_4_4
120,8,4096,False,torch.bfloat16,torch.float32,False,hipblaslt,95833,8.65,Cijk_Alik_Bljk_BSS_BH_Bias_HAS_SAV_UserArgs_MT16x16x512_MI16x16x1_SN_LDSB1_AFC1_AFEM1_AFEM1_ASEM1_CLR1_CADS0_DTVA0_EPS0_FDSI0_GRPM1_GRVWA8_GRVWB8_GSUAMB_GLS0_ISA942_IU1_K1_LBSPPA1024_LBSPPB1024_LBSPPM0_LPA16_LPB16_LPM0_LRVW8_LWPMn1_MIAV1_MIWT1_1_MO40_NTn1_NTA0_NTB0_NTC0_NTD0_NTM0_NEPBS16_NLCA1_NLCB1_ONLL1_PGR2_PLR1_PKA1_SIA3_SS1_SPO0_SRVW0_SSO0_SVW1_TLDS1_ULSGRO0_USL1_UIOFGRO0_USFGROn1_VSn1_VWA1_VWB1_WSGRA0_WSGRB0_WG16_4_4
112,8,4096,False,torch.bfloat16,torch.float32,False,hipblaslt,95793,8.65,Cijk_Alik_Bljk_BSS_BH_Bias_HAS_SAV_UserArgs_MT16x16x512_MI16x16x1_SN_LDSB1_AFC1_AFEM1_AFEM1_ASEM1_CLR1_CADS0_DTVA0_EPS0_FDSI0_GRPM1_GRVWA8_GRVWB8_GSUAMB_GLS0_ISA942_IU1_K1_LBSPPA1024_LBSPPB1024_LBSPPM0_LPA16_LPB16_LPM0_LRVW8_LWPMn1_MIAV1_MIWT1_1_MO40_NTn1_NTA0_NTB0_NTC0_NTD0_NTM0_NEPBS16_NLCA1_NLCB1_ONLL1_PGR2_PLR1_PKA1_SIA3_SS1_SPO0_SRVW0_SSO0_SVW1_TLDS1_ULSGRO0_USL1_UIOFGRO0_USFGROn1_VSn1_VWA1_VWB1_WSGRA0_WSGRB0_WG16_4_4
104,8,4096,False,torch.bfloat16,torch.float32,False,hipblaslt,95793,8.6,Cijk_Alik_Bljk_BSS_BH_Bias_HAS_SAV_UserArgs_MT16x16x512_MI16x16x1_SN_LDSB1_AFC1_AFEM1_AFEM1_ASEM1_CLR1_CADS0_DTVA0_EPS0_FDSI0_GRPM1_GRVWA8_GRVWB8_GSUAMB_GLS0_ISA942_IU1_K1_LBSPPA1024_LBSPPB1024_LBSPPM0_LPA16_LPB16_LPM0_LRVW8_LWPMn1_MIAV1_MIWT1_1_MO40_NTn1_NTA0_NTB0_NTC0_NTD0_NTM0_NEPBS16_NLCA1_NLCB1_ONLL1_PGR2_PLR1_PKA1_SIA3_SS1_SPO0_SRVW0_SSO0_SVW1_TLDS1_ULSGRO0_USL1_UIOFGRO0_USFGROn1_VSn1_VWA1_VWB1_WSGRA0_WSGRB0_WG16_4_4
96,8,4096,False,torch.bfloat16,torch.float32,False,hipblaslt,98179,8.58,Cijk_Alik_Bljk_BSS_BH_Bias_HAS_SAV_UserArgs_MT16x16x512_MI16x16x1_SN_LDSB1_AFC1_AFEM1_AFEM1_ASEM1_CLR1_CADS0_DTVA0_EPS0_FDSI0_GRPM1_GRVWA8_GRVWB8_GSUAMB_GLS0_ISA942_IU1_K1_LBSPPA1024_LBSPPB1024_LBSPPM0_LPA16_LPB16_LPM0_LRVW8_LWPMn1_MIAV1_MIWT1_1_MO40_NTn1_NTA0_NTB0_NTC0_NTD0_NTM0_NEPBS16_NLCA1_NLCB1_ONLL1_PGR2_PLR1_PKA1_SIA3_SS1_SPO0_SRVW0_SSO0_SVW1_TLDS1_ULSGRO0_USL1_UIOFGRO0_USFGROn1_VSn1_VWA1_VWB1_WSGRA0_WSGRB0_WG16_4_4
88,8,4096,False,torch.bfloat16,torch.float32,False,hipblaslt,98367,8.66,Cijk_Alik_Bljk_BSS_BH_Bias_HAS_SAV_UserArgs_MT16x16x512_MI16x16x1_SN_LDSB1_AFC1_AFEM1_AFEM1_ASEM1_CLR1_CADS0_DTVA0_EPS0_FDSI0_GRPM1_GRVWA8_GRVWB8_GSUAMB_GLS0_ISA942_IU1_K1_LBSPPA1024_LBSPPB1024_LBSPPM0_LPA16_LPB16_LPM0_LRVW8_LWPMn1_MIAV1_MIWT1_1_MO40_NTn1_NTA0_NTB0_NTC0_NTD0_NTM0_NEPBS16_NLCA1_NLCB1_ONLL1_PGR2_PLR1_PKA1_SIA3_SS1_SPO0_SRVW0_SSO0_SVW1_TLDS1_ULSGRO0_USL1_UIOFGRO0_USFGROn1_VSn1_VWA1_VWB1_WSGRA0_WSGRB0_WG16_4_4
80,8,4096,False,torch.bfloat16,torch.float32,False,hipblaslt,95833,8.66,Cijk_Alik_Bljk_BSS_BH_Bias_HAS_SAV_UserArgs_MT16x16x512_MI16x16x1_SN_LDSB1_AFC1_AFEM1_AFEM1_ASEM1_CLR1_CADS0_DTVA0_EPS0_FDSI0_GRPM1_GRVWA8_GRVWB8_GSUAMB_GLS0_ISA942_IU1_K1_LBSPPA1024_LBSPPB1024_LBSPPM0_LPA16_LPB16_LPM0_LRVW8_LWPMn1_MIAV1_MIWT1_1_MO40_NTn1_NTA0_NTB0_NTC0_NTD0_NTM0_NEPBS16_NLCA1_NLCB1_ONLL1_PGR2_PLR1_PKA1_SIA3_SS1_SPO0_SRVW0_SSO0_SVW1_TLDS1_ULSGRO0_USL1_UIOFGRO0_USFGROn1_VSn1_VWA1_VWB1_WSGRA0_WSGRB0_WG16_4_4
72,8,4096,False,torch.bfloat16,torch.float32,False,hipblaslt,95793,8.57,Cijk_Alik_Bljk_BSS_BH_Bias_HAS_SAV_UserArgs_MT16x16x512_MI16x16x1_SN_LDSB1_AFC1_AFEM1_AFEM1_ASEM1_CLR1_CADS0_DTVA0_EPS0_FDSI0_GRPM1_GRVWA8_GRVWB8_GSUAMB_GLS0_ISA942_IU1_K1_LBSPPA1024_LBSPPB1024_LBSPPM0_LPA16_LPB16_LPM0_LRVW8_LWPMn1_MIAV1_MIWT1_1_MO40_NTn1_NTA0_NTB0_NTC0_NTD0_NTM0_NEPBS16_NLCA1_NLCB1_ONLL1_PGR2_PLR1_PKA1_SIA3_SS1_SPO0_SRVW0_SSO0_SVW1_TLDS1_ULSGRO0_USL1_UIOFGRO0_USFGROn1_VSn1_VWA1_VWB1_WSGRA0_WSGRB0_WG16_4_4
64,8,4096,False,torch.bfloat16,torch.float32,False,hipblaslt,95833,8.57,Cijk_Alik_Bljk_BSS_BH_Bias_HAS_SAV_UserArgs_MT16x16x512_MI16x16x1_SN_LDSB1_AFC1_AFEM1_AFEM1_ASEM1_CLR1_CADS0_DTVA0_EPS0_FDSI0_GRPM1_GRVWA8_GRVWB8_GSUAMB_GLS0_ISA942_IU1_K1_LBSPPA1024_LBSPPB1024_LBSPPM0_LPA16_LPB16_LPM0_LRVW8_LWPMn1_MIAV1_MIWT1_1_MO40_NTn1_NTA0_NTB0_NTC0_NTD0_NTM0_NEPBS16_NLCA1_NLCB1_ONLL1_PGR2_PLR1_PKA1_SIA3_SS1_SPO0_SRVW0_SSO0_SVW1_TLDS1_ULSGRO0_USL1_UIOFGRO0_USFGROn1_VSn1_VWA1_VWB1_WSGRA0_WSGRB0_WG16_4_4
56,8,4096,False,torch.bfloat16,torch.float32,False,hipblaslt,98179,8.58,Cijk_Alik_Bljk_BSS_BH_Bias_HAS_SAV_UserArgs_MT16x16x512_MI16x16x1_SN_LDSB1_AFC1_AFEM1_AFEM1_ASEM1_CLR1_CADS0_DTVA0_EPS0_FDSI0_GRPM1_GRVWA8_GRVWB8_GSUAMB_GLS0_ISA942_IU1_K1_LBSPPA1024_LBSPPB1024_LBSPPM0_LPA16_LPB16_LPM0_LRVW8_LWPMn1_MIAV1_MIWT1_1_MO40_NTn1_NTA0_NTB0_NTC0_NTD0_NTM0_NEPBS16_NLCA1_NLCB1_ONLL1_PGR2_PLR1_PKA1_SIA3_SS1_SPO0_SRVW0_SSO0_SVW1_TLDS1_ULSGRO0_USL1_UIOFGRO0_USFGROn1_VSn1_VWA1_VWB1_WSGRA0_WSGRB0_WG16_4_4
48,8,4096,False,torch.bfloat16,torch.float32,False,hipblaslt,98179,8.63,Cijk_Alik_Bljk_BSS_BH_Bias_HAS_SAV_UserArgs_MT16x16x512_MI16x16x1_SN_LDSB1_AFC1_AFEM1_AFEM1_ASEM1_CLR1_CADS0_DTVA0_EPS0_FDSI0_GRPM1_GRVWA8_GRVWB8_GSUAMB_GLS0_ISA942_IU1_K1_LBSPPA1024_LBSPPB1024_LBSPPM0_LPA16_LPB16_LPM0_LRVW8_LWPMn1_MIAV1_MIWT1_1_MO40_NTn1_NTA0_NTB0_NTC0_NTD0_NTM0_NEPBS16_NLCA1_NLCB1_ONLL1_PGR2_PLR1_PKA1_SIA3_SS1_SPO0_SRVW0_SSO0_SVW1_TLDS1_ULSGRO0_USL1_UIOFGRO0_USFGROn1_VSn1_VWA1_VWB1_WSGRA0_WSGRB0_WG16_4_4
40,8,4096,False,torch.bfloat16,torch.float32,False,hipblaslt,96442,8.6,Cijk_Alik_Bljk_BSS_BH_Bias_HAS_SAV_UserArgs_MT16x16x512_MI16x16x1_SN_LDSB1_AFC1_AFEM1_AFEM1_ASEM1_CLR1_CADS0_DTVA0_EPS0_FDSI0_GRPM1_GRVWA8_GRVWB8_GSUAMB_GLS0_ISA942_IU1_K1_LBSPPA1024_LBSPPB1024_LBSPPM0_LPA16_LPB16_LPM0_LRVW8_LWPMn1_MIAV1_MIWT1_1_MO40_NTn1_NTA0_NTB0_NTC0_NTD0_NTM0_NEPBS16_NLCA1_NLCB1_ONLL1_PGR2_PLR1_PKA1_SIA3_SS1_SPO0_SRVW0_SSO0_SVW1_TLDS1_ULSGRO0_USL1_UIOFGRO0_USFGROn1_VSn1_VWA1_VWB1_WSGRA0_WSGRB0_WG16_4_4
32,8,4096,False,torch.bfloat16,torch.float32,False,hipblaslt,96442,8.61,Cijk_Alik_Bljk_BSS_BH_Bias_HAS_SAV_UserArgs_MT16x16x512_MI16x16x1_SN_LDSB1_AFC1_AFEM1_AFEM1_ASEM1_CLR1_CADS0_DTVA0_EPS0_FDSI0_GRPM1_GRVWA8_GRVWB8_GSUAMB_GLS0_ISA942_IU1_K1_LBSPPA1024_LBSPPB1024_LBSPPM0_LPA16_LPB16_LPM0_LRVW8_LWPMn1_MIAV1_MIWT1_1_MO40_NTn1_NTA0_NTB0_NTC0_NTD0_NTM0_NEPBS16_NLCA1_NLCB1_ONLL1_PGR2_PLR1_PKA1_SIA3_SS1_SPO0_SRVW0_SSO0_SVW1_TLDS1_ULSGRO0_USL1_UIOFGRO0_USFGROn1_VSn1_VWA1_VWB1_WSGRA0_WSGRB0_WG16_4_4
24,8,4096,False,torch.bfloat16,torch.float32,False,hipblaslt,98179,8.58,Cijk_Alik_Bljk_BSS_BH_Bias_HAS_SAV_UserArgs_MT16x16x512_MI16x16x1_SN_LDSB1_AFC1_AFEM1_AFEM1_ASEM1_CLR1_CADS0_DTVA0_EPS0_FDSI0_GRPM1_GRVWA8_GRVWB8_GSUAMB_GLS0_ISA942_IU1_K1_LBSPPA1024_LBSPPB1024_LBSPPM0_LPA16_LPB16_LPM0_LRVW8_LWPMn1_MIAV1_MIWT1_1_MO40_NTn1_NTA0_NTB0_NTC0_NTD0_NTM0_NEPBS16_NLCA1_NLCB1_ONLL1_PGR2_PLR1_PKA1_SIA3_SS1_SPO0_SRVW0_SSO0_SVW1_TLDS1_ULSGRO0_USL1_UIOFGRO0_USFGROn1_VSn1_VWA1_VWB1_WSGRA0_WSGRB0_WG16_4_4
16,8,4096,False,torch.bfloat16,torch.float32,False,hipblaslt,96442,8.53,Cijk_Alik_Bljk_BSS_BH_Bias_HAS_SAV_UserArgs_MT16x16x512_MI16x16x1_SN_LDSB1_AFC1_AFEM1_AFEM1_ASEM1_CLR1_CADS0_DTVA0_EPS0_FDSI0_GRPM1_GRVWA8_GRVWB8_GSUAMB_GLS0_ISA942_IU1_K1_LBSPPA1024_LBSPPB1024_LBSPPM0_LPA16_LPB16_LPM0_LRVW8_LWPMn1_MIAV1_MIWT1_1_MO40_NTn1_NTA0_NTB0_NTC0_NTD0_NTM0_NEPBS16_NLCA1_NLCB1_ONLL1_PGR2_PLR1_PKA1_SIA3_SS1_SPO0_SRVW0_SSO0_SVW1_TLDS1_ULSGRO0_USL1_UIOFGRO0_USFGROn1_VSn1_VWA1_VWB1_WSGRA0_WSGRB0_WG16_4_4
8,8,4096,False,torch.bfloat16,torch.float32,False,hipblaslt,98367,8.5,Cijk_Alik_Bljk_BSS_BH_Bias_HAS_SAV_UserArgs_MT16x16x512_MI16x16x1_SN_LDSB1_AFC1_AFEM1_AFEM1_ASEM1_CLR1_CADS0_DTVA0_EPS0_FDSI0_GRPM1_GRVWA8_GRVWB8_GSUAMB_GLS0_ISA942_IU1_K1_LBSPPA1024_LBSPPB1024_LBSPPM0_LPA16_LPB16_LPM0_LRVW8_LWPMn1_MIAV1_MIWT1_1_MO40_NTn1_NTA0_NTB0_NTC0_NTD0_NTM0_NEPBS16_NLCA1_NLCB1_ONLL1_PGR2_PLR1_PKA1_SIA3_SS1_SPO0_SRVW0_SSO0_SVW1_TLDS1_ULSGRO0_USL1_UIOFGRO0_USFGROn1_VSn1_VWA1_VWB1_WSGRA0_WSGRB0_WG16_4_4
4,8,4096,False,torch.bfloat16,torch.float32,False,hipblaslt,96442,8.54,Cijk_Alik_Bljk_BSS_BH_Bias_HAS_SAV_UserArgs_MT16x16x512_MI16x16x1_SN_LDSB1_AFC1_AFEM1_AFEM1_ASEM1_CLR1_CADS0_DTVA0_EPS0_FDSI0_GRPM1_GRVWA8_GRVWB8_GSUAMB_GLS0_ISA942_IU1_K1_LBSPPA1024_LBSPPB1024_LBSPPM0_LPA16_LPB16_LPM0_LRVW8_LWPMn1_MIAV1_MIWT1_1_MO40_NTn1_NTA0_NTB0_NTC0_NTD0_NTM0_NEPBS16_NLCA1_NLCB1_ONLL1_PGR2_PLR1_PKA1_SIA3_SS1_SPO0_SRVW0_SSO0_SVW1_TLDS1_ULSGRO0_USL1_UIOFGRO0_USFGROn1_VSn1_VWA1_VWB1_WSGRA0_WSGRB0_WG16_4_4
2,8,4096,False,torch.bfloat16,torch.float32,False,hipblaslt,98179,8.49,Cijk_Alik_Bljk_BSS_BH_Bias_HAS_SAV_UserArgs_MT16x16x512_MI16x16x1_SN_LDSB1_AFC1_AFEM1_AFEM1_ASEM1_CLR1_CADS0_DTVA0_EPS0_FDSI0_GRPM1_GRVWA8_GRVWB8_GSUAMB_GLS0_ISA942_IU1_K1_LBSPPA1024_LBSPPB1024_LBSPPM0_LPA16_LPB16_LPM0_LRVW8_LWPMn1_MIAV1_MIWT1_1_MO40_NTn1_NTA0_NTB0_NTC0_NTD0_NTM0_NEPBS16_NLCA1_NLCB1_ONLL1_PGR2_PLR1_PKA1_SIA3_SS1_SPO0_SRVW0_SSO0_SVW1_TLDS1_ULSGRO0_USL1_UIOFGRO0_USFGROn1_VSn1_VWA1_VWB1_WSGRA0_WSGRB0_WG16_4_4
1,8,4096,False,torch.bfloat16,torch.float32,False,hipblaslt,98367,8.55,Cijk_Alik_Bljk_BSS_BH_Bias_HAS_SAV_UserArgs_MT16x16x512_MI16x16x1_SN_LDSB1_AFC1_AFEM1_AFEM1_ASEM1_CLR1_CADS0_DTVA0_EPS0_FDSI0_GRPM1_GRVWA8_GRVWB8_GSUAMB_GLS0_ISA942_IU1_K1_LBSPPA1024_LBSPPB1024_LBSPPM0_LPA16_LPB16_LPM0_LRVW8_LWPMn1_MIAV1_MIWT1_1_MO40_NTn1_NTA0_NTB0_NTC0_NTD0_NTM0_NEPBS16_NLCA1_NLCB1_ONLL1_PGR2_PLR1_PKA1_SIA3_SS1_SPO0_SRVW0_SSO0_SVW1_TLDS1_ULSGRO0_USL1_UIOFGRO0_USFGROn1_VSn1_VWA1_VWB1_WSGRA0_WSGRB0_WG16_4_4
