aiter/ops/triton/configs/MI300X-GEMM-A16W16.json
{
  "small": {
    "BLOCK_SIZE_M": 256,
    "BLOCK_SIZE_N": 256,
    "BLOCK_SIZE_K": 64,
    "GROUP_SIZE_M": 4,
    "num_warps": 8,
    "num_stages": 2,
    "waves_per_eu": 2,
    "matrix_instr_nonkdim": 16,
    "kpack": 1
  },
  "medium": {
    "BLOCK_SIZE_M": 256,
    "BLOCK_SIZE_N": 256,
    "BLOCK_SIZE_K": 64,
    "GROUP_SIZE_M": 4,
    "num_warps": 8,
    "num_stages": 2,
    "waves_per_eu": 2,
    "matrix_instr_nonkdim": 16,
    "kpack": 1
  },
  "large": {
    "BLOCK_SIZE_M": 256,
    "BLOCK_SIZE_N": 256,
    "BLOCK_SIZE_K": 64,
    "GROUP_SIZE_M": 4,
    "num_warps": 8,
    "num_stages": 2,
    "waves_per_eu": 2,
    "matrix_instr_nonkdim": 16,
    "kpack": 1
  }
}